url,summary
https://www.courts.ca.gov/documents/6DCA-Habeas-Attorney-Applicants.pdf,"The Sixth District Court of Appeal is looking for lawyers to represent inmates in death penalty-related habeas corpus proceedings in the superior courts. If you are interested in applying, you must meet certain qualifications and submit an application. Attorneys with their principal place of business in the Sixth District should submit their applications electronically, while attorneys with their principal place of business in other locations in California should submit their applications to the regional committee with jurisdiction over their principal place of business. Attorneys with their principal place of business outside the State of California should submit their applications to the regional committee for the First District Court of Appeal."
https://www.courts.ca.gov/documents/DCA-Guide-To-Electronic-Appellate-Documents.pdf,"This guide provides instructions on how to create electronic documents to be filed with the California Courts of Appeal and Supreme Court. It focuses on using Microsoft Word and Adobe Acrobat Pro XI. It outlines the steps for creating electronic appellate briefs, original proceedings, and other documents. It also explains how to paginate, create bookmarks, redact, and make text searchable. It is important to follow the court's rules and local regulations for formatting electronic documents."
https://www.courts.ca.gov/documents/ctappbro.pdf,"The California Courts of Appeal are intermediate courts of review that ensure the law is interpreted and applied correctly. They review appeals from cases heard in a superior court and other matters prescribed by statute. The state is divided into 6 appellate districts, with 19 divisions and 101 justices. An appeal is a request to a higher court to review a decision made in a completed trial or proceeding. The Courts of Appeal decide questions of law and do not hear testimony or retry cases. The process involves filing a notice of appeal, submitting briefs, and hearing oral arguments. A concurrence of two out of the three justices is necessary to form a majority opinion. The California Supreme Court and the U.S. Supreme Court can review decisions of the Courts of Appeal."
https://www.courts.ca.gov/documents/4DCA-Prop66-Recruitment.pdf,"The Fourth District Court of Appeal is looking for lawyers to represent people who have been sentenced to death in their habeas corpus proceedings in the superior courts. If you are interested in applying, you can find the qualification criteria and application for appointment on the links provided. If you have your principal place of business in the Fourth District, you should send your completed application and materials to the email or postal address provided."
https://www.courts.ca.gov/documents/4dca-div1-Guidelines-for-E-Reporters-Transcripts.pdf,"This set of guidelines outlines the requirements for electronic court transcripts. The document must be numbered, have a master index, and be bookmarked. It must be searchable and not password protected. Hyperlinks are encouraged and there should be no additional cost to the court."
https://www.courts.ca.gov/documents/4DCA-Appellate-Self-Help-Workshop-2023.pdf,"This is a workshop for high school students who are parties to an unlimited civil case on appeal from the superior court to the Court of Appeal. It will teach important information about what is required at the Court of Appeal, especially if the student does not have an attorney. The workshop is free and will be held virtually via Zoom. It will provide helpful hints on how to fill out forms and comply with the court’s rules and procedures. It will not provide legal advice or handle the student's appeal. The workshop will take place on the third Tuesday of each month in 2023."
https://www.courts.ca.gov/documents/dca-TrueFiling-Quick-Start-Guide.pdf,"TrueFiling is an online filing system for legal documents. This guide explains how to log in, add attorneys and staff to your firm, set email notifications, initiate a case, search for a case, add a firm member as a case contact, add a new contact to a case and to your firm, add registered opposing counsel as a case contact, create a bundle and its filings, add a connected document, submit the bundle, change a filing property to ""serve only"", download the proof of service, download an official file stamped copy, download a filing's payment receipt, and add a payment account."
https://www.courts.ca.gov/documents/4DCA-Electronic-Devices-in-the-Courtroom.pdf,"Courts of Appeal in California have adopted a policy allowing the use of laptop computers and tablets in court rooms during oral arguments. These devices must be silenced and placed in ""airplane mode"" at all times. They can only be used by lawyers or self-represented litigants to aid in presenting oral argument and cannot be used to display evidence. Cellular phones and other electronic devices are not allowed and no audio or video recording or photography is permitted without following the California Rules of Court. Anyone who does not follow this policy will be removed from the court room."
https://www.courts.ca.gov/documents/Fee_Schedule_07.01.23_5DCA.pdf,
https://www.courts.ca.gov/documents/5DCA-Prop66-Recruitment.pdf,"The Court of Appeal, Fifth Appellate District is looking for lawyers to represent people sentenced to death in their habeas corpus proceedings in the superior courts. If you are interested in applying, you can find the qualification criteria and application on the website provided. If you are a lawyer with your principal place of business in the Fifth District, you should send your completed application and materials to the email address provided."
https://www.courts.ca.gov/documents/5DCA-Security-Screening-Procedures.pdf,"When visiting the Court of Appeal, Fifth Appellate District, you must go through a security screening process. This includes walking through a metal detector and having any items you bring in inspected. You must also follow certain rules while in the courtroom, such as remaining silent and not addressing the court. No electronic devices, weapons, food, drinks, or animals (except service animals) are allowed in the courtroom. You must also remove any metal or non-metal objects from your person and wear appropriate clothing."
https://www.courts.ca.gov/documents/5dca-Reporter-Transcripts-Formatting-Guidelines.pdf,"In order to make a reporter's transcript easier to use, it should be merged into a single volume and have a master index of all hearings, witnesses, and exhibits. This master index should be hyperlinked to each of these locations. Each volume should also have a cover page and bookmarks for the exhibits and word index."
https://www.courts.ca.gov/documents/5DCA-SuperiorCourts-ReferenceManual.pdf,
http://www.courts.ca.gov/documents/trial-court-records-manual.pdf,"This manual provides guidance on how to manage trial court records in California. It covers topics such as filing papers in court, record classification, storage and maintenance, electronic signing, exhibits management, public access, and more. It is intended to help trial court leaders develop strategic solutions to manage paper and electronic records."
https://www.courts.ca.gov/documents/Local-Rule-Changes-20230605.pdf,"This is a set of rules for the Court of Appeal First Appellate District in California. It outlines procedures for oral argument, including the option to waive argument, the information needed to make an election to present oral argument, the amount of time allocated for each side, and the dates for oral argument. It also explains the recording and streaming of oral argument, requests for continuances, and the use of electronic devices in the courtroom."
https://www.courts.ca.gov/documents/Misc._order_2023-1_031323.pdf,"This is a legal document that was filed in a court of appeal on March 13, 2023 by a deputy clerk."
https://www.courts.ca.gov/documents/1DCA-Prop66-Recruitment.pdf,"The Court of Appeal, First Appellate District is looking for lawyers to represent people in death penalty-related habeas corpus proceedings in the superior courts. If you are interested in applying for an appointment, you can find the qualification criteria and application form online. The rate of pay for this representation has not been set yet. If you have your principal place of business in the First District or outside of California, you can send your application and materials to the email provided."
https://newsroom.courts.ca.gov/sites/default/files/newsroom/2022-03/Statewide%20Order%20Changes%20by%20CJ-Chair%20of%20JC%20%28030322%29.pdf,"In response to the COVID-19 pandemic, the Chief Justice of California issued orders to extend the time for certain judicial proceedings, such as arraignments, preliminary examinations, and criminal and civil trials. These orders have now been rescinded due to changing conditions in California, and courts are no longer able to extend the time for these proceedings. Courts may still use technology to conduct proceedings remotely."
https://www.courts.ca.gov/documents/3dca_APPEALS-TRANSCRIPT-TRAINING-MANUAL.pdf,"Electronic Clerk's Transcript C084752_CR_electronicER_raf_Carbajal Electronic Reporter's Transcript Page 22 Juvenile Cases J084752_JV_electronicRT_raf_Carbajal Original Reporter's Transcript J084752_JV_electronicCT_raf_Carbajal Electronic Clerk's Transcript J084752_JV_electronicER_raf_Carbajal Electronic Reporter's Transcript Civil Cases C084752_CV_electronicRT_raf_Carbajal Original Reporter's Transcript C084752_CV_electronicCT_raf_Carbajal Electronic Clerk's Transcript C084752_CV_electronicER_raf_Carbajal Electronic Reporter's Transcript This is a training manual for court clerks on how to prepare an electronic clerk's transcript. It covers topics such as gathering documents, redacting, creating a clerk's certificate, combining files in Adobe, creating an index and cover page, inserting additional documents, pagination, adding bookmarks, updating the index and cover page, replacing documents, updating pagination, splitting volumes, pagination across multi-volume transcripts, naming conventions, and Axway uploading."
https://www.courts.ca.gov/documents/3DC_EmergencyOrder_04092020.pdf,"Due to the COVID-19 pandemic, the Judicial Council of California has authorized the six district Courts of Appeal to extend certain time periods by up to 30 days. On April 4, 2020, the Judicial Council amended a rule to help the courts continue to operate during the pandemic. This order applies retroactively to the starting date of the court’s current implementation order."
https://www.courts.ca.gov/documents/3DC_ImplementationOrder_04132020.pdf,"The California Court of Appeal has issued an order that extends all time periods specified by the California Rules of Court for 30 days from the date of the specified event between March 20, 2020 and April 19, 2020. This means that any act required or permitted under the California Rules of Court will have an extra 30 days to be completed. The Court retains the discretion to disallow an extension of time under appropriate circumstances."
https://www.courts.ca.gov/documents/3DC_EmergencyOrder_04152020.pdf,"This order from the Judicial Council of California allows the six district Courts of Appeal to extend by no more than 30 days the time periods specified by the California Rules of Court. This order is in effect for proceedings that would occur between April 2020 and May 18, 2020 due to the COVID-19 pandemic."
https://www.courts.ca.gov/documents/3DC_ImplementationOrder_04172020.pdf,"The California Court of Appeal has issued an emergency order extending all time periods specified by the California Rules of Court that occur between April 20, 2020 and May 18, 2020 by 30 days. This means that deadlines for court-related activities will be extended for 30 days, without the need to apply for an extension. The Court retains the discretion to disallow an extension of time or to order that an action be taken within a specified time frame. This order is effective immediately."
https://www.courts.ca.gov/documents/3dca-MiscOrder2020-001.pdf,"The Third District Court of Appeal in California has issued an order extending all time periods specified by the California Rules of Court that occur between April 20 and May 18, 2020, for 30 days. However, this extension does not apply to briefs in juvenile dependency appeals and writs. If a party needs an extension of time, they must file an application for an extension."
https://www.courts.ca.gov/documents/appdistmap.pdf,"In California, there are six appellate districts that are divided into smaller counties. These districts are the First Appellate District (Alameda, Contra Costa, Marin, Napa, San Francisco, San Mateo, Solano, Sonoma, Del Norte, Humboldt, Lake, Mendocino), Second Appellate District (Los Angeles, San Luis Obispo, Santa Barbara, Ventura), Third Appellate District (Alpine, Amador, Calaveras, Mono, San Joaquin, Butte, Colusa, El Dorado, Glenn, Lassen, Modoc, Nevada, Placer, Plumas, Sacramento, Shasta, Sierra, Siskiyou, Sutter, Tehama, Trinity, Yolo, Yuba), Fourth Appellate District (Inyo, Imperial, Orange, Riverside, San Bernardino, San Diego), Fifth Appellate District (Fresno, Kings, Madera, Mariposa, Merced, Stanislaus, Tulare, Tuolumne, Kern), and Sixth Appellate District."
https://www.courts.ca.gov/documents/hc100.pdf,"This form is for attorneys who are applying to be included on a panel of qualified attorneys to represent people in death penalty-related habeas corpus proceedings. The form requires applicants to provide information about their experience, training, and qualifications, as well as attestations and recommendations from other attorneys."
https://www.courts.ca.gov/documents/2dca_Misc_ORD_2022-02.pdf,
https://www.courts.ca.gov/documents/2dca-Appellate-Attorney-Central-Staff-0422.pdf,
https://www.courts.ca.gov/documents/2DCA-Prop66-Recruitment.pdf,"The Second District Court of Appeal is looking for lawyers to represent people who have been sentenced to death in habeas corpus proceedings in Los Angeles, Ventura, Santa Barbara and San Luis Obispo Superior Courts. If you are interested in applying, you can find the qualification criteria and application on the Second District Court of Appeal website. Attorneys with their principal place of business in the Second District should send their completed application and materials to the email or postal address provided."
https://www.courts.ca.gov/documents/habeas_panel.pdf,"This is a list of attorneys who are part of the Statewide Habeas Attorney Panel and are compliant with 4.562 regulations. It includes the attorney's name, bar number, county of principal place of business, and appellate district. The list was updated in February 2020."
https://www.courts.ca.gov/documents/2DCA-Electronic-Formatting-Req-Guide.pdf,"This document outlines the formatting requirements and guidelines for documents filed electronically with the Second District Court in California. This includes text-searchable PDFs, cover pages, pagination, electronic bookmarks, file size, multiple files, privacy protection, font style, spacing, margins, alignment, quotation marks, and hyperlinking."
https://www.courts.ca.gov/documents/dca2-guide-to-consecutive-pagination.pdf,"When creating a document with multiple PDF files, the pages must be numbered consecutively. This means that if the first file ends on page 234, the second file must begin on page 235. To ensure the pages are numbered correctly, open the second PDF file in Adobe Acrobat and use the ""Number Pages"" tool to set the starting page number. Repeat this process for any additional files in the document."
https://www.courts.ca.gov/documents/Consecutive_Pagination_Across_Multiple_PDF_Files-Adobe_DC.pdf,"When creating a document that consists of multiple PDF files, the pages must be numbered consecutively. This means that if the first file ends on page 234, the second file must begin on page 235. To do this, open the second PDF file in Adobe Acrobat, click View, select Show/Hide, and then select Page Thumbnails. Then, select Page Labels, select All, and change the Start parameter to match the first page of the file. Save the file and repeat this process for any additional files."
https://www.courts.ca.gov/documents/2DCA-eFiling-guidelines.pdf,"The Court of Appeal, Second Appellate District has guidelines for filing electronic documents in the court that a party wants to become part of the record on appeal. When filing a motion, application, or request, the party should submit documents as a separate .pdf file at the same time. Documents over 300 pages can be submitted electronically as long as the file size is 25 megabytes or smaller. If creating your own proof of service, include it as the last page of the filing, and file the Civil Case Information Statement after a docket number has been assigned."
https://www.courts.ca.gov/documents/4DCA-eFiling-Adobe-PDF-Bookmark-Zoom-Settings.pdf,"When viewing a PDF document, bookmarks can contain specific zoom settings that change the zoom percentage each time a bookmark is clicked. This can be annoying for viewers who want to set their own zoom setting. To fix this, the PDF creator needs to go back and change the zoom setting for each bookmark to ""Inherit Zoom"" so that the viewer's zoom setting will stay the same when clicking on bookmarks."
https://www.courts.ca.gov/documents/2DCA-eFiling-Sample-Brief.pdf,"This case is about a dispute between The Three Bears and Goldilocks. The Three Bears sued Goldilocks for trespassing on their property, claiming she entered their home when they were not at home, ate their food, and fell asleep in one of their beds. After a trial, the court found Goldilocks guilty of trespass and ordered her to pay the Three Bears $50,000. Goldilocks is appealing the decision, arguing that she had implied consent to enter the house and her entry was not wrongful. The court of appeals will decide whether or not Goldilocks had implied consent to enter the Three Bears' house."
https://www.courts.ca.gov/documents/2DCA-eFiling-Sample-Appendix.pdf,"This is a legal document outlining the court proceedings between two parties, The Three Bears and Goldilocks. It includes a chronological and alphabetical index of documents filed, appendices, and proof of service."
https://www.courts.ca.gov/documents/2DCA-eFiling-Sample-Writ-Petition.pdf,"This is a legal document from a court of appeal in California. Goldilocks is petitioning the court to vacate an order denying her motion for summary judgment. The document contains a Petition for Writ of [Type of Writ], a Verification, a Memorandum of Points and Authorities, a Certificate of Compliance, Exhibits, and Proof of Service."
https://www.courts.ca.gov/documents/2DCA-eFiling-Sample-Writ-Exhibits.pdf,"This is a legal document from the Court of Appeal of California. It is an index of exhibits for a case involving Goldilocks, the Three Bears, and the Los Angeles County Superior Court. It includes documents such as a First Amended Complaint, Answer to First Amended Complaint, Notice of Motion for Summary Judgment, Memorandum of Points and Authorities in Support of Motion for Summary Judgment, Separate Statement of Undisputed Facts in Support of Motion for Summary Judgment, and Declaration of Robert Southey in Support of Motion for Summary Judgment."
https://www.courts.ca.gov/documents/2DCA-eFiling-Sample-Exhibits-Motion-Request-Application.pdf,"This case is about The Three Bears suing Goldilocks for an unknown reason. The case is in the Court of Appeal of the State of California Second Appellate District. The documents being used in the case are listed in the index of exhibits, which includes a First Amended Complaint, Answer to First Amended Complaint, Notice of Motion for Summary Judgment, Memorandum of Points and Authorities in Support of Motion for Summary Judgment, Separate Statement of Undisputed Facts in Support of Motion for Summary Judgment, and Declaration of Robert Southey in Support of Motion for Summary Judgment."
https://www.courts.ca.gov/documents/2DCA-Hours-Courtroom.pdf,The Clerk's Office for Los Angeles and Ventura are open from 9:00 a.m. to 4:30 p.m. Monday through Friday. The Clerk's Office for Division Six in Ventura is on the ground floor and the Clerk's Office in Los Angeles is on the Second Floor in the North Tower of the Ronald Reagan State Building. The Courtroom in Los Angeles is located on the Third Floor of the Ronald Reagan State Building. Laptops and tablets are allowed in the courtroom as an aid in presenting oral argument but cell phones and other electronic devices are not allowed. No audio or video recording or taking of photographs is allowed unless approved.
https://www.courts.ca.gov/documents/2023-6dca-calendar-portrait.pdf,"This text is about a computer programming language called ""i255."" It is used to create programs and applications that can be used on computers. It is a complex language that requires a lot of knowledge and understanding to use properly. It is important for high school students to understand the basics of programming languages such as i255 in order to be successful in the future."
https://www.courts.ca.gov/documents/AppellateJudicialMentorApplication.pdf,"The California Court of Appeal Judicial Mentor Program is an opportunity for high school students to gain insight into the judicial system. The application includes questions about the applicant's legal experience, such as when they were admitted to the California Bar and the nature of their appellate practice. It also includes questions about any judicial committees, community organizations, or legal professional societies the applicant has been involved in. The program requires participants to meet with their mentor at least twice in a six-month period and the mentor will provide advice and encouragement."
https://www.scscourt.org/court_divisions/appellate/appellate_home.shtml,
https://www.courts.ca.gov/documents/6dca-misc-order-20-002.pdf,"This court order states that due to the public emergency created by the COVID-19 virus, oral arguments at the Sixth District Court of Appeal will be conducted by telephone instead of in person until further notice. The proceedings will still be open to the public and members of the press."
https://www.courts.ca.gov/documents/jv820.pdf,"A juvenile court has made an order setting a hearing under Welfare and Institutions Code section 366.26. This hearing may result in the termination of parental rights and adoption of the child. If you want to challenge the court's decision, you must file a Notice of Intent to File Writ Petition and Request for Record within 7-27 days from the date the court set the hearing, depending on your location. You must also provide copies of the petition to all parties in the case, the child's CASA volunteer, the child's present caregiver, and any de facto parent who has standing to participate in the juvenile court proceedings."
https://www.courts.ca.gov/documents/sample_order_ext_request.pdf,John Doe is a lawyer representing Party Two in a court case in California. The court has granted an extension of time for Party Two to file their opening brief.
https://www.courts.ca.gov/documents/mc275.pdf,"This form is used to challenge a criminal conviction or confinement conditions in the Superior Court or Court of Appeal. It must be filled out carefully and accurately, as making a false statement may lead to a conviction for perjury. The form requires information such as the plea entered, the length of the sentence, and the grounds for relief. It also requires information about any prior petitions, appeals, or other matters filed in any court. The form must be filed in the county that made the order or in the county in which the petitioner is confined."
https://www.courts.ca.gov/documents/6DCAproc.pdf,"in the subject matter of the petition. (Rule 8.486(a)(2).) The petitioner must be a party to the underlying action or a person whose rights are directly affected by the order. (See, e.g., People v. Superior Court (Romero) (1996) 13 Cal.4th 497, 509- 510.) Outline of Original Proceedings and Relief Ancillary to Appeal March 2011 7 Record: The petition must include a record of the proceedings in the lower court. (Rule 8.486(b).) The record must include, at a minimum, the order challenged, the pleadings pro and con leading up to the order, the transcript of the hearing if any, anything else needed to give a full understanding of what the lower court did and its reasons for doing so, and the identity of the lower court judge. (Rule 8.486(b).) The record must be bound together at the end of the petition or in separate volumes not to exceed 300 pages each. (Rule 8.486(c)(1).) Exhibits must begin with a table of contents, must be index -tabbed by number or letter , must be paginated consecutively , and must be bound together at the end"
https://www.courts.ca.gov/documents/6DCAproc.doc,
https://www.courts.ca.gov/documents/IOP_District6.pdf,"This document explains the internal operating practices of the Court of Appeal, Sixth Appellate District. It covers the structure of the court, the organization of staff, the process of appeals, and other procedures. It is important for high school students to be aware of the court system and how it works."
