url,summary
https://www.courts.ca.gov/documents/1dca-anthony-j-kline.pdf,"Justice J. Anthony Kline is a presiding justice who graduated from Johns Hopkins University with honors and later attended graduate school at Cornell University and Yale Law School. After law school, he served as a law clerk to a California Supreme Court Justice and then worked as an attorney in New York. He then returned to California and worked as a Legal Services Lawyer and was one of the founders of Public Advocates, Inc., the first non-profit public interest law firm in the west. In 1975, he was appointed Legal Affairs Secretary to Governor Edmund G. Brown, Jr. and in 1980 he was appointed to the San Francisco Superior Court. In 1982, he was appointed Presiding Justice of the Court of Appeal. He is currently Chairman of the Board of Directors of the San Francisco Conservation Corps and a member of the Board of Directors of the Golden Gate Kindergarten Association and the American Jewish Congress (Northern California Division)."
https://www.courts.ca.gov/documents/Legacy_KLINE_Final_(002).pdf,"Justice J. Anthony Kline is a former California Court of Appeal Justice who grew up in post-war America in a diverse neighborhood on Long Island. He attended public schools and went on to college at Johns Hopkins, where he majored in philosophy. He then went to Yale Law School and clerked for a progressive judge on the California Supreme Court. After graduating, he moved to New York City and worked at a prestigious law firm, Davis Polk & Wardwell. He eventually returned to California to work in the Legal Services Program, where he worked on class action lawsuits involving substandard housing and stopping urban renewal projects and federal aid highways that were displacing people from affordable housing."
https://www.courts.ca.gov/documents/Low_Harry_W_Biography.pdf,"Harry W. Low was a retired presiding justice of the Court of Appeal, First Appellate District, Division Five. He was appointed to the newly-created position by Governor Brown Jr. in 1982 and was confirmed by the Commission on Judicial Appointments and the electorate. He also served as an Assistant Administrative Presiding Justice of the Court, a Judge of the Superior Court, a Judge of the Municipal Court, and a Deputy Attorney General. He was a member of various professional, civic, and charitable organizations, and was the first judge of Chinese-American ancestry in Northern California. He was also a professor at the University of California, Boalt Hall School of Law and a lecturer for various judicial seminars and study committees. He was a Democrat."
https://www.courts.ca.gov/documents/Harry_Low_6046.pdf,"and Santa Cruz and all of that. So it was kind of a very interesting role. I was appointed by Jerry Brown at the very tail end of his administration , and I took office in January of ’83. William Stein: You were the Presiding J ustice of the First District for a while, weren’t you? Harry Low: Yeah, I was the Presiding J ustice of the First District for a period of time , and I was the Presiding J ustice of Division Five for a period of time . William Stein: Do you want to talk a little bit about the role of the Presiding J ustice? Harry Low: Yeah. The role of the Presiding J ustice is a very interesting role. I think it’s a role that requires a lot of diplomacy and a lot of tact . You have to be able to deal with the other justices , and you have to be able to deal with the staff , and you have to be able to deal with the bar . And I think that it’s a very important role , because the Presiding J ustice kind of sets the tone for the division . California Appellate Court Legacy Project – Video Interview Transcript: Justice Harry Low [Harry_Low"
https://www.courts.ca.gov/documents/ACLP-1-Marchiano-bio.pdf,"Justice James Marchiano was appointed to the California Court of Appeal by Governor Davis in 2002 and was reconfirmed by the electorate in 2006. He was previously a judge on the Superior Court in Contra Costa County and a private law practice partner in Oakland and San Francisco. He was named ""State Trial Judge of the Year"" by the California Trial Lawyers Association and ""Trial Judge of the Year"" by the Alameda-Contra Costa Trial Lawyers Association. He has lectured and taught at several universities and has written several publications. He is a Democrat and Catholic."
https://www.courts.ca.gov/documents/ACLP-1-Marchiano-Transcript.pdf,"Justice James Marchiano was born in Detroit to immigrant parents and moved to California at a young age. He attended a prep seminary and then St. Patrick's College, followed by Boalt Hall for his J.D. degree. He then worked as a lawyer for the Bledsoe firm in San Francisco and the Crosby firm in Oakland. He was encouraged to join the bench by his students and colleagues, and was eventually appointed by Governor Deukmejian to the Superior Court in Martinez, California."
https://www.courts.ca.gov/documents/Newsom_Jr_William_A_Biography.pdf,"William Alfred Newsom Jr. was a retired associate justice of the Court of Appeal in California. He was appointed by Governor Brown Jr. in 1978 and confirmed by the electorate in 1979. He was also a judge of the Superior Court in Placer County from 1975 to 1978, and worked as an assistant commissioner in the Superior Court of San Francisco from 1962 to 1963. He had a J.D. from Stanford Law School, an M.A. in English Literature from Stanford, and a B.A. in French Literature from the University of San Francisco. He enjoyed backpacking, fishing, bird watching, and book and wine collecting."
https://www.courts.ca.gov/documents/Newsom_Jr_William_A_6048.pdf,"William Newsom was a third-generation San Franciscan who grew up in the Marina and went to college at USF, majoring in French literature. After law school, he worked as an assistant commissioner of the San Francisco Superior Court and then went on to work for a famous San Francisco attorney, James Martin MacInnis. He then moved to Squaw Valley and opened a one-man law practice in Tahoe City, where he did a lot of environmental law. Later, he was appointed to a new position in Placer County, where he was sworn in by Judge Leland Propp, despite Propp's reluctance. He went on to serve as an Associate Justice of the California Court of Appeal, Division One, for many years."
https://www.courts.ca.gov/documents/Parrilli_Joanne_C_Biography.pdf,"Justice Joanne C. Parrilli was appointed to the Court of Appeal, First Appellate District, Division Three by Governor Wilson in 1995. She was previously a Judge of the Superior Court, Alameda County, appointed by Governor Deukmejian in 1988, and before that a Deputy District Attorney and a Special Prosecutor. She has been a member of many organizations and has taught at various universities. She graduated from San Francisco State University with a B.A. in Anthropology and from the University of San Francisco Law School with a J.D."
https://www.courts.ca.gov/documents/Joanne_Parrilli_6233.pdf,"ll leave that for another time.

Retired Justice Joanne Parrilli grew up in Chicago as part of a large Italian family. She was encouraged by her parents to pursue a good education, and attended private Catholic school all the way through grammar school, high school, and college. She was interested in acting and considered leaving school to pursue a career in the theater, but was encouraged by a nun to finish her education. She moved to California in 1968 and worked various jobs before deciding to pursue law. She attended the University of San Francisco for law school and was part of an experimental clinic in her second year. She was fascinated by the criminal courts and decided to work in the Alameda County District Attorney's Office. She faced some resistance as a female trial lawyer, but was successful in her career and eventually became a justice on the California Court of Appeal."
https://www.courts.ca.gov/documents/Peterson_J_Clinton_Biography.pdf,"John Clinton Peterson was a retired presiding justice of the Court of Appeal, First Appellate District, Division Five. He was appointed by Governor Wilson in 1992 and confirmed by the Commission on Judicial Appointments and the electorate. He also served as an Associate Justice on the same court from 1988 to 1992, and as a Judge in the Superior Court of Solano County from 1986 to 1988. He was a lawyer in private practice for many years and served in the U.S. Air Force during the Korean War. He was admitted to the California Bar in 1954 and to the U.S. Supreme Court in 1961. He was a Republican and enjoyed hunting, fishing, playing golf, and reading."
https://www.courts.ca.gov/documents/JClinton_Peterson_6038.pdf,"Justice J. Clinton Peterson was born in Winchester, Idaho and graduated from the University of Idaho School of Law in 1951. He served in the Air Force during the Korean War and took the California bar exam while still in the service. After passing the bar, he worked as a deputy district attorney in Solano County for two years before going into private practice for 30 years. He handled a variety of cases, including family law, personal injury, eminent domain, and will contests. In 1988, he was appointed to the First District Court of Appeal and served there until 1998."
https://www.courts.ca.gov/documents/Poche_Marcel_Biography.pdf,"Marcel Poche was appointed to a newly-created position on the Court of Appeal by Governor Brown Jr. in 1978. He was also a judge on the Superior Court in Santa Clara County from 1977 to 1979. He had previously worked as an assistant to Governor Brown Jr. and an executive assistant to Congressman Don Edwards. He was also a professor of law at the University of Santa Clara from 1969 to 1977. He served in the U.S. Marine Corps from 1956 to 1958 and has a law degree from the University of California, Berkeley. He was named ""Appellate Justice of the Year"" in 1981 and received the ""Owens Award"" from the University of Santa Clara in 1981."
https://www.courts.ca.gov/documents/Marcel_Poche_6027.pdf,"Civil Procedure,"" and then I taught a small class in ""Civil Rights"" and a small class in ""Constitutional Law."" And then I had a seminar in ""Civil Rights,"" which I think I taught for three years. And then I taught a seminar in ""Civil Procedure"" for a year or two. Patricia Sepulveda: And then you were appointed to the court. California Appellate Court Legacy Project – Video Interview Transcript: Justice Marcel Poch e [Marcel_Poche_6027.doc ] Transcribed by Tech-Synergy ; proofread by Lisa Crystal Page 6 of 38

Marcel Poché was born in New Orleans but raised in California. He attended Bellarmine Prep in San Jose and then went to the University of Santa Clara, majoring in political science and graduating with honors. After two years in the Marine Corps, he attended Boalt Hall Law School and went into private practice in San Jose. He then taught law at Santa Clara University for 10-11 years and ran for the California Assembly, losing by 1,000 votes. He then taught at Boalt Hall and was appointed to the First District Court of Appeal in San Francisco, where he served for 20 years. After retiring, he returned to San Jose"
https://www.courts.ca.gov/documents/Stuart-R-Pollak-1DCA-bio.pdf,"Stuart R. Pollak is a Presiding Justice of the First District Court of Appeal, Division Four. He was born in San Pedro, California in 1937 and graduated from Lowell High School in San Francisco as valedictorian in 1955. He then went on to Stanford University and Harvard Law School, graduating with honors. He has worked as a law clerk to Chief Justice Earl Warren, a Special Assistant to the Assistant Attorney General, and a staff member of the President's Commission on the Assassination of President John F. Kennedy. He was also a partner at Howard Rice Nemerovski Canady & Pollak and a Judge of the San Francisco Superior Court."
https://www.courts.ca.gov/documents/Racanelli_John_T_Biography.pdf,"John T. Racanelli was a retired Presiding Justice of the Court of Appeal, First Appellate District, Division One. He was appointed by Governor Brown Jr. in 1977 and confirmed by the electorate in 1978 and 1982. He served in the U.S. Army Air Corps during World War II and the Korean War and was a private law practitioner before his appointment. He was also an adjunct assistant professor of law, a faculty member of The Rutter Group Update Program, and a panelist for the State Bar Convention. He was a member of the National Council on Crime & Delinquency, the California Judges Association, the Santa Clara County Bar Association, and the Bar Association of San Francisco. He was a recipient of the ""Brotherhood Award and Torch of Freedom"" and the ""Order of Merit"" from the President of the Republic of Italy. He was named ""Trial Judge of the Year"" by the California Trial Lawyers Association. After his retirement, he became a private judge and a member of the Judicial Arbitration & Mediation Services, Inc."
https://www.courts.ca.gov/documents/John_Racanelli_6020.pdf,"John Racanelli was a judge in the First District Court of Appeal in California from 1977 to 1991. He was born in Pennsylvania, but his family moved to San Francisco in 1943 due to his father's health. He enlisted in the Army Air Corps at the age of 18 and served in both World War II and the Korean War. After being discharged, he went to UC Berkeley and then to Hastings College of the Law, graduating in 1952. He passed the bar in the same year and started practicing law the day after he was discharged from the military. He believes his military experience gave him a sense of responsibility and opened his eyes to the world."
https://www.courts.ca.gov/documents/ACLP-1-Rivera-bio.pdf,"a deputy public defender, said, ""She is not as well versed in criminal law as some of the other judges."" On Motions Attorneys said Judge Rizk is ""very good"" at managing her courtroom. ""She is very organized,"" said one. Another said, ""She is very efficient."" A third interviewee said, ""She is very good at keeping things moving."" Courtroom atmosphere Most of the interviewees said Judge Rizk's courtroom atmosphere is ""professional"" and ""businesslike."" One attorney said, ""She is very serious."" On Trial Interviewees said Judge Rizk is ""very fair"" when handling trials. One attorney said, ""She is very even-handed."" Another said, ""She is very fair and impartial."" A third interviewee said, ""She is very good at keeping the parties focused on the issues."" Continuances Attorneys said Judge Rizk is ""very reasonable"" when it comes to granting continuances. One interviewee said, ""She is very understanding."" Proclivities Most of the interviewees said Judge Rizk is ""fair"" overall. One interviewee said, ""She is very even-handed."" Summary One attorney offered the following additional comment: ""She is very good at"
https://www.courts.ca.gov/documents/3_Interview_Transcrpt_Template_Maria_Rivera_2.pdf,"Justice Maria Rivera is a retired Associate Justice of the First District Court of Appeal, Division Four. She is from a unique combination of backgrounds, with her grandfather and grandmother being Puerto Rican and her father being an Episcopal priest and the first elected Hispanic bishop in the United Episcopal Church. Her mother was a daughter of the Mayflower and descended from the Starbucks and Coffins in the East Coast. Justice Rivera inherited a love of the outdoors from her father and discipline from her mother. She has three sisters, one of whom followed in her father's footsteps and became a priest and bishop. Justice Rivera has five sons, three of which are stepsons and two of her own. She met her husband, Jim, at her first job after law school and he had a successful career in antitrust law. They took a trip to Berlin to attend a 50th reunion of the first class of Stanford in Germany and extended the trip to visit other places in the area. Justice Rivera attended a boarding school in Arizona for three years before finishing her last two years of high school in Visalia. She attended Smith College and majored in Hispanic Studies and minored in Psychology. Smith College lived up to her expectations."
https://www.courts.ca.gov/documents/Ignaco-J-Ruvolo-Biography.pdf,"Justice Ignacio J. Ruvolo was appointed Presiding Justice of the First Appellate District, Division Four, by Governor Schwarzenegger in 2006 and elected for a term commencing in 2007. He was previously appointed and elected to the Contra Costa County Superior Court and had a private law practice in San Francisco and Walnut Creek. He has been a member of various legal organizations, including the American Bar Association, the State Bar Commission for the Revision to the Rules of Professional Conduct, and the Judicial Council Appellate Advisory Committee. He has also taught at Hastings College of the Law and authored several articles on legal topics. Justice Ruvolo holds a J.D. from the University of San Diego School of Law, an L.L.M. from the University of Virginia School of Law, and a B.A. from Rutgers University."
https://www.courts.ca.gov/documents/Ignazio_Ruvolo_7287.pdf,"Justice Ignazio Ruvolo was born in Elizabeth, New Jersey and came from a blue-collar family. His parents met through his mother's sister who worked at an umbrella factory. He has three siblings, Paula, Angela, and Peter, all of whom live in different states. He has two children, Michael and Sarah, who are both biologists, and four grandchildren. He married Barbara, who he met at Rossmoor, and they have been together for a year and a half. He is a history major and was the student council president in high school. He also played football and was a shot putter for track and field. After high school, he attended Wreckers."
https://www.courts.ca.gov/documents/Sabraw_M_O_Biography.pdf,Justice M.O. Sabraw was appointed to the Court of Appeal by Governor Deukmejian in 1984 and confirmed by the Commission on Judicial Appointments in 1985. He was also a judge in the Superior Court and Municipal Court in Alameda County from 1968-1985. He served in the US Army during World War II and was admitted to the California Bar in 1953. He is a Republican and enjoys raising and riding horses and skiing. He has authored several significant decisions in the Court of Appeal.
https://www.courts.ca.gov/documents/MO_Sabraw_6026.pdf,"Justice Modeste Orton Sabraw moved to San Francisco from Canada at the age of 11 during the Great Depression. He went on to graduate from the University of California and Boalt Hall School of Law, and eventually became a judge in the Alameda County Superior Court and the First District Court of Appeal in San Francisco. He was not allowed to join the Air Force because he was an alien, but was drafted into the Army and later granted citizenship."
https://www.courts.ca.gov/documents/Gabriel_P._Sanchez-1DCA_bio.pdf,"Justice Sanchez was appointed to the First Appellate District in 2018 by Governor Edmund G. Brown, Jr. He has a long history of working in criminal justice reform, including managing and directing all state and federal prisoner class action cases and other significant corrections litigation and appeals. He also advised the Governor on criminal justice reform legislation, executive appointments, parole and clemency decisions. Justice Sanchez graduated from Yale College and Yale Law School and clerked for the Honorable Richard A. Paez on the United States Court of Appeals for the Ninth Circuit. He currently lives in Oakland, California with his wife and son."
https://www.courts.ca.gov/documents/Sepulveda_Patricia_K_Biography.pdf,"Justice Patricia K. Sepulveda was appointed to the California Appellate Court in 1989 and was re-elected in 1990 and 1996. She was a Deputy District Attorney in Contra Costa County from 1978-1989 and was a member of the California Judges Association from 1989-present. She has a JD from Hastings College of the Law and a BA in Psychology from the University of California, Berkeley. She is a Republican and is divorced with two children."
https://www.courts.ca.gov/documents/Patricia_Sepulveda_0515.pdf,"Justice Patricia Sepulveda was born and raised in Fresno, California. She went to the University of San Francisco and then transferred to UC Berkeley, where she got her degree in Psychology. She was inspired to go to law school by her classmate, Bert Levy, and attended Hastings College of the Law. After passing the bar exam, she got a job as an attorney at the Contra Costa District Attorney's office. She enjoyed the research and writing, and was encouraged to apply for a judgeship. She was appointed to the Superior Court and then to the First District Court of Appeal, Division Four, where she served from 1998 to 2012. During her time there, she wrote 125 published opinions and enjoyed criminal cases the most."
https://www.courts.ca.gov/documents/Strankman_Gary_E_Biography.pdf,"Gary Elvin Strankman is a Presiding Justice of the Court of Appeal, First Appellate District, Division One. He was appointed by Governor Wilson in 1991, confirmed by the Commission on Judicial Appointments, and confirmed by the electorate in 1994. He was also an Associate Justice of the same court from 1988-1991 and a Judge of the Superior Court in Contra Costa County from 1981-1988. He was a Deputy District Attorney in Contra Costa County from 1968-1978 and Chief Assistant District Attorney from 1978-1980. He has taught at various universities and colleges and authored several significant opinions. He has a J.D. from the University of California, Boalt Hall School of Law, an LL.M. from the University of Virginia School of Law, an M.A. from San Francisco State University, and a B.A. from the University of Washington. He enjoys reading, listening to music, and frequenting coffee shops."
https://www.courts.ca.gov/documents/Strankman_Gary_E_6021.pdf,"This is an interview with Justice Gary E. Strankman, who served on the First District Court of Appeal in California from 1988 to 2001. He grew up on an Indian reservation in Washington and went on to attend the University of Washington, majoring in English literature. He was encouraged to pursue a legal career by an uncle, and went on to get his law degree from Boalt Hall in 1966. After graduating, he worked at the Contra Costa Legal Services Foundation and then applied to be a district attorney. Justice Strankman's story is an inspiring one of success against the odds."
https://www.courts.ca.gov/documents/Swager_Douglas_E_Biography.pdf,"Douglas Elmer Swager is an Associate Justice of the Court of Appeal, First Appellate District, Division One. He was nominated by Governor Wilson in 1995 and confirmed by the Commission on Judicial Appointments. He was previously a Judge of the Superior Court in Contra Costa, appointed by Governor Deukmejian in 1987, and a Judge of the Municipal Court in the Bay Judicial District, appointed by Governor Deukmejian in 1985. Prior to his judicial career, he was a private law practitioner in Richmond, California from 1973-1985. He holds a J.D. from Hastings College of the Law and a B.S. in Business Administration from the University of California, Berkeley. He is a Republican and a Catholic."
https://www.courts.ca.gov/documents/Douglas_Swager_6393.pdf,"Justice Douglas Swager and Justice Timothy Reardon are being interviewed for the California Appellate Court Legacy Project, which is creating an oral history of the appellate court in California. Justice Swager was born and raised in Richmond, California and attended Portola Junior High School and Harry Ells High School in Richmond. He went on to attend the University of California at Berkeley, majoring in Business Administration, and then Hastings College of the Law. Justice Reardon was also a graduate of Hastings College of the Law. During the interview, Justice Swager discussed his upbringing and his decision to pursue a career in law."
https://www.courts.ca.gov/documents/Walker_Herbert_W_Biography.pdf,"Herbert Weston Walker was appointed to the California Court of Appeal, First District, Division Three by Governor Wilson in 1996. He had previously been appointed to the Superior Court of Napa County in 1985, and was re-elected in 1986 and 1992. He authored Napa County Rules for Administration of Civil Litigation, and served as a Presiding Judge of the Appellate Department. He had a private law practice from 1960-1985, and was a Deputy County Counsel for Los Angeles County from 1958-1959. He graduated from the University of Southern California Law School in 1958, and from Stanford University in 1955. He enjoys the outdoors, photography, woodworking, and travel."
https://www.courts.ca.gov/documents/Wes_Walker_6052.pdf,"Justice Wes Walker was a native Californian who grew up with a father who was a judge. He attended Glendale High School and then Stanford University, where he majored in geology before deciding to pursue a career in law. He attended USC Law School and then worked for the Los Angeles County Counsel before joining a law firm in Santa Ana. He eventually became the managing partner of the firm and then moved to Napa in 1980. He was appointed to the Napa Superior Court in 1985 and was active in trial delay reduction efforts. In 1996, he was appointed to the California Appellate Court, Division Three."
