url,summary
https://www.courts.ca.gov/documents/Timothy_Buckley_6023.pdf,"Justice Timothy Buckley was an Associate Justice for the Court of Appeal, Fifth Appellate District. He was born in Hanford, California in 1945, the son of two school teachers. He looked up to many people, including friends from different walks of life, and enjoyed sports and reading. He attended Lemoore High School, where he was in the same class as Tommie Smith, who went on to own or share 11 world records. After graduating from high school, he attended Coalinga College (now West Hills) and then UC Santa Barbara. He eventually pursued a career in law and became a successful judge."
https://www.courts.ca.gov/documents/aclp-5-Cornell_Dennis_A_Biography.pdf,"Justice Dennis A. Cornell was appointed to the California Appellate Court in 1992 by Governor Wilson and was re-elected in 1998. He was a United States Magistrate Judge from 1986 to 1992 and had a private law practice from 1972 to 1992. He was a member of the California Judges Association, the Cow County Judges Association, the American Judicature Society, the California Trial Lawyers Association, and the Merced County Bar Association. He was admitted to the California Bar, the U.S. Court of Appeals, the U.S. District Court, and the U.S. Supreme Court. He is a Democrat and enjoys playing golf, softball, running, and spending time with his family."
https://www.courts.ca.gov/documents/Dennis_Cornell_7097.pdf,"Retired Associate Justice Dennis A. Cornell of the California Court of Appeal Fifth Appellate District was born and raised in Merced, California. His parents were a civil engineer and a homemaker. He was expected to go to college and ended up attending Stanford University, where he majored in Political Science and developed an interest in the Civil War. He worked for the water system and did stadium announcing during college. He then attended George Washington University Law School in Washington DC, where he was exposed to the Vietnam War, Watergate, and the death penalty arguments in the Supreme Court. He also got to visit the U.S. Supreme Court several times and met Justice Thurgood Marshall."
https://www.courts.ca.gov/documents/Betty_Dawson_Biography.pdf,"Betty L. Dawson is an Associate Justice of the Court of Appeal, Fifth Appellate District. She was appointed in 2003 and has held other judicial offices, such as Judge of the Superior Court in Merced County. Before becoming a judge, she had a private law practice and was a research attorney for the California Court of Appeal. She has been a member of various organizations, such as the California Judges Association and the National Association of Women Judges. She has also taught at Merced College and was a teaching fellow at Stanford Law School. She has a law degree from Hastings College of the Law and a bachelor's degree in history from San Francisco State University. She is married with two children and enjoys travel, gardening, and the outdoors."
https://www.courts.ca.gov/documents/6864_Dawson.pdf,"Justice Betty Dawson was born in Minnesota and moved to California as a child with her family in search of better economic opportunities. She grew up in Santa Rosa, California, and was not a good student in school. She married her high school sweetheart, but the marriage did not last. She met her current husband, Robert Haden, through her brother and they traveled around South America together. She was dared by Robert to finish her B.A. and go to law school, so she did. She attended Hastings Law School and graduated second in her class of 518 students. She was an extern at the California Supreme Court during the time when Rose Bird was appointed Chief Justice. She was a teaching fellow at Stanford Law School during the 1978-79 school year."
https://www.courts.ca.gov/documents/ACLP-Kane_Stephen_J-Bio.pdf,
https://www.courts.ca.gov/documents/ACLP-Kane_Stephen_J-transcript.pdf,"Stephen Kane is a retired Associate Justice of the Fifth District Court of Appeal in Fresno. He grew up in San Mateo, California and had a loving family. His mother, Mary Catherine Galligan -Kane, and his father, who was a retired member of the Court of Appeal First Appellate District, had a big influence on him. His father was appointed by President Reagan to be the Ambassador to Ireland. Stephen Kane is married to Brenda and they have four children. During his formal, early educational period, he attended Bellarmine College Preparatory in San Jose, a Jesuit-run college prep school. He met lifelong friends there, including Judge Larry O'Neill. Stephen Kane's experiences and relationships with his family and friends have had a big impact on his life."
https://www.courts.ca.gov/documents/Martin_Robert_L_Biography.pdf,"Robert Leslie Martin was appointed to a newly-created position on the Court of Appeals by Governor Brown Jr. in 1982. Prior to this, he was a judge on the Superior Court of Fresno County from 1977 to 1982. He had a private law practice from 1964 to 1977, and was a Deputy and Senior Deputy District Attorney from 1960 to 1964. He was also a member of the California Judges Association, American Bar Association, Fresno County Bar Association, and served on the Fresno Community Council and Fresno County Volunteer Bureau. He served in the U.S. Army during the Korean War and graduated from Lincoln University Law School in 1958."
https://www.courts.ca.gov/documents/RobertL_Martin_6018.pdf,"Robert L. Martin is a former Justice of the Fifth District Court of Appeal. He grew up in Vallejo, California and was influenced by a Miss Letson, his high school counselor. He knew from a young age that he wanted to be a lawyer and worked hard to make it happen. He attended Vallejo Junior College, worked, and was drafted into the Army. After his military service, he was able to attend law school with the help of the GI Bill. He served 20 years as a jurist and is known for being a tough, no-nonsense judge. He also has a talent for cooking. This story is an example of how hard work and dedication can help you achieve your goals."
https://www.courts.ca.gov/documents/Thaxter_James_F_Biography.pdf,"Justice James F. Thaxter was appointed to the Court of Appeals, Fifth Appellate District by Governor Deukmejian in 1989 and was confirmed by the Commission on Judicial Appointments in 1990. He had previously served as a judge on the Superior Court of Fresno County from 1985 to 1990. Prior to this, he had a private law practice focusing on business litigation and probate contests. Justice Thaxter authored several noteworthy opinions, including Putnam v. Clague (1992) and People v. Berry (1990). He graduated with a LL.B from Hastings College of the Law in 1959 and also holds a B.A. from Fresno State College, an A.A. from the University of California, Berkeley, and a high school diploma from Fresno High School. He is a Republican and enjoys backpacking and reading."
https://www.courts.ca.gov/documents/JamesF_Thaxter_6022.pdf,"Justice James F. Thaxter was a retired associate justice of the Fifth District Court of Appeal in California. He was born in Fresno and attended Fresno High School, Fresno State, UC Berkeley, and Hastings College of Law. He was interviewed as part of the California Appellate Court Legacy Project, which is creating an oral history of the appellate courts and their justices. He discussed his upbringing, his education, and his marriage to Carol Nixon. He also discussed his time in law school, where he was involved in law review, the Thurston Honor Society, and Order of the Coif. He returned to Fresno after graduating from law school in 1959 and was admitted to the bar that same year."
https://www.courts.ca.gov/documents/Vartabedian_Steven_M_Biography.pdf,"Steven Michael Vartabedian is an Associate Justice on the Court of Appeal, Fifth Appellate District. He was appointed by Governor Deukmejian in 1989 and confirmed by the Commission on Judicial Appointments. He was also elected by the electorate to an 8-year term in 1990 and retained by the electorate for a 12-year term in 1998. He has previously served as a Judge on the Superior Court, Municipal Court, and Justice Court in Fresno County. He has a J.D. from the University of Santa Clara Law School, a B.A. from California State University, Fresno, and graduated from Roosevelt High School, Sequoia Junior High School, and Winchell Elementary School in Fresno. He is a Republican and a Presbyterian."
https://www.courts.ca.gov/documents/Steven_Vartabedian_6575.pdf,"Justice Steven Vartabedian is a retired justice of the Court of Appeal, Fifth District. His family heritage is Armenian and Lebanese, and his grandparents came to the United States with very little education. His grandfather, Solomon, worked for United States Steel and eventually moved to Fresno, California to become a farmer. Justice Vartabedian was encouraged to pursue an education by his grandparents, and he graduated from Roosevelt High School and Fresno State. He then went on to Santa Clara University Law School, where he was initially intimidated by his classmates from Ivy League schools. He and his wife, Marilyn, met at Fresno State."
https://www.courts.ca.gov/documents/ACLP-5-Wiseman-bio.docx,
https://www.courts.ca.gov/documents/ACLP-5-Wiseman-Transcript.pdf,"Justice Rebecca Wiseman was born in Sanger, California and grew up in Fresno. Her father had a very interesting life, having run away from home at 16 and riding a rail to California. He worked in the Central San Joaquin Valley picking grapes and driving trucks. During World War II, he was a glider pilot in the mission ""A Bridge Too Far"" and was captured by the Germans. Her mother was from Pennsylvania and worked for the Department of Agriculture. Rebecca attended McClain High School and Fresno State, majoring in Journalism. She wanted to be a TV broadcaster and got her first job at KOVR in Sacramento. After a bad experience at a job interview, she decided to go to law school. She went on to have a successful career as an Associate Justice of the Fifth District Court of Appeal in Fresno, retiring in 2013."
https://www.courts.ca.gov/documents/Zenovich_George_N_Biography.pdf,"George N. Zenovich was a retired Associate Justice of the Court of Appeal in the Fifth Appellate District. He was appointed by Governor Brown, Jr. in 1979 and confirmed by the electorate in 1982. Before his appointment, he was a California State Senator, California State Assemblyman, and a private law practitioner. He was admitted to the California Bar in 1953, the U.S. Supreme Court in 1969, and the U.S. District Court in 1976. He was a Democrat and a member of St. Peter the Apostle Serbian Church in Fresno. He enjoyed playing the bass and photography."
https://www.courts.ca.gov/documents/GeorgeN_Zenovich_6016.pdf,"Justice George N. Zenovich was a retired justice of the Fifth District Court of Appeals in California. He was appointed to the court by Governor Jerry Brown and confirmed in March 1979. He had previously served a distinguished career in the state Legislature, starting in 1963. He had become a part of the Democratic leadership quickly and had authored some significant legislation, including the Zenovich-Moscone-Chacon Housing and Home Finance Act. He had also been involved in funding for the Diagnostic School in 1973 for neurologically handicapped children. He wrote an opinion that kept the building industry in business."
https://www.courts.ca.gov/documents/Justice-Nat-Agliano-bio.pdf,"James Publishing has given permission for us to use their copyrighted material, which is up to date as of the date of publication."
https://www.courts.ca.gov/documents/Agliano_6781.pdf,"Nat Agliano fell into a legal career almost by accident when he was visiting Boalt Hall, the law school at Berkeley. He then went to Hastings Law School and worked in the Attorney General's Office for three years. During this time, he handled criminal law cases and argued cases in the Court of Appeal. After leaving the Attorney General's Office, he went into private practice and argued a criminal case before the Supreme Court."
https://www.courts.ca.gov/documents/Brauer_Harry_F_Biography.pdf,"Harry F. Brauer was a retired associate justice of the Court of Appeal, Sixth Appellate District. He was appointed to the newly-created court by Governor Deukmejian in 1984, and was confirmed by the Commission on Judicial Appointments and the electorate in 1986. He retired from the bench in 1989. Prior to this, he was a judge of the Superior Court and Municipal Court in Santa Cruz County. He was admitted to the California Bar in 1952 and was a Democrat. He enjoyed mountain climbing, backpacking, fishing, and listening to classical music."
https://www.courts.ca.gov/documents/Harry_Brauer_6060.pdf,"Justice Harry Brauer was one of three original justices appointed to the California Appellate Court in 1984. He was born in Germany in 1926 and fled to the Philippines in 1939 to escape Hitler. During World War II, he attended Catholic school and learned English quickly. After the war, his family moved to the United States and he was accepted to the University of Chicago. He then went on to Yale Law School and eventually became an Associate Justice of the Sixth District Court of Appeal. He retired in 1989 and now lives in Arizona."
https://www.courts.ca.gov/documents/Cottle_Christopher_C_Biography.pdf,"Christopher Clarke Cottle was appointed to the Court of Appeal, Sixth Appellate District, by Governor Wilson in 1993 and confirmed by the Commission on Judicial Appointments. He was also confirmed by the electorate in 1994. Prior to this, he was an Associate Justice of the same court from 1988 to 1993. He was also a Judge of the Superior Court of Santa Cruz County from 1977 to 1988 and a District Attorney and Assistant District Attorney for Santa Cruz County from 1975 to 1977 and 1968 to 1975, respectively. He attended Stanford University on a football scholarship, and graduated from Hastings College of the Law in 1966. He is a Democrat and Episcopalian."
https://www.courts.ca.gov/documents/Christopher_Cottle_6135.pdf,"Christopher Cottle was a Justice of the Court of Appeal 6th District who grew up in Los Angeles and went to Morningside High School. He was a good athlete and was involved in basketball, football, and baseball. He almost went to the University of California, but changed his mind and went to Stanford on a football scholarship. He was team captain his senior year and was a center on offense and a linebacker on defense. After graduating from Stanford, he worked for a year and then decided to go to law school at Hastings in San Francisco."
https://www.courts.ca.gov/documents/Nathan-D-Mihara-bio.pdf,"Associate Justice Nathan D. Mihara is a judge in the California State Court of Appeal, Sixth Appellate District. He received his B.A. degree in economics from the University of Washington in 1972 and his Juris Doctor degree from Hastings College of Law in 1975. He has been a lecturer and moderator for many judicial education programs, bar association seminars and local high schools. He is also active in his community with Little League Baseball, the American Youth Soccer Association and his church."
https://www.courts.ca.gov/documents/Nathan_Mihara_FINAL.pdf,"who is a junior in college. She is a wonderful young lady, and she is studying to be a nurse. So, that's my family.

Justice Nathan Mihara was born in Tokyo in 1950 to parents who had met in an internment camp for Japanese Americans during World War II. His father worked for the U.S. Army Intelligence Service and his mother worked as a secretary for General MacArthur's staff. He spent his childhood traveling around the U.S. and Japan with his parents, eventually settling in Hawaii. He has two siblings, Diane (who passed away) and Ted, and a niece, Annika. His sister Diane was known for her charitable work, while his brother Ted is an entrepreneur in software sales."
https://www.courts.ca.gov/documents/Justice-Richard-J-McAdams-bio.pdf,"Richard John McAdams is an Associate Justice of the Sixth District Court of Appeal. He was appointed by Governor Brown Jr. in 1977, and was elected to the Superior Court in 1998. He has held various positions in the legal field, including private law practice, staff attorney/directing attorney for the Legal Aid Society of Santa Cruz County, and associate for Jarvis, Miller & Stender. He has also been involved in various organizations, such as the California Judges Association, the California Judicial Council, and the California Center for Judicial Education and Research. He received his J.D. from Hastings College of the Law, and his B.A. from the University of California, Berkeley."
https://www.courts.ca.gov/documents/McAdams_6780.pdf,"Richard McAdams was an Associate Justice at the Sixth District Court of Appeal. He enjoyed the collegiality and working with a group to solve a legal problem. He was born in Albany, California and grew up in El Cerrito, Pasadena, and San Mateo. After high school, he attended the University of Oregon and then transferred to the University of California, Berkeley. After graduating, he married his high school sweetheart, Claire, and then attended law school at the University of California, Hastings. He worked at a law firm doing research in maritime law and eventually joined the firm after graduating and passing the bar."
https://www.courts.ca.gov/documents/Wunderlich_William_M_Biography.pdf,"William Martin Wunderlich was a magistrate judge of the United States District Court in the Eastern District of California, Yosemite Office. He was appointed Associate Justice of the 6th District Court of Appeal by Governor Wilson in 1993 and confirmed by the electorate in 1994 and 2002. He was also a Judge of the Superior Court of Monterey County from 1985 to 1993 and a Deputy District Attorney of Monterey County from 1973 to 1980. He was a member of the California Judges Association, the California Judges Foundation, and the Monterey Bar Foundation. He received the ""Young Alumnus of the Year Award"" from the University of Nebraska in 1987. He was admitted to the California Bar and the U.S. District Court in 1972."
https://www.courts.ca.gov/documents/William_Wunderlich_6181.pdf,"William Wunderlich is a United States Magistrate Judge for the Eastern District of California, assigned to the courthouse in Yosemite National Park. He was born and raised in Lincoln, Nebraska, and attended a Catholic school there. He was the valedictorian of his graduating class of 21 students, and went on to the University of Nebraska for college. While there, he met his wife at a Freshman Camp, and they were married four months later when he was 18."
http://www.courts.ca.gov/documents/coa100booklet.pdf,"ers to help dispose of backlog of cases.1889Two more commissioners added.1900Proposed constitutional amendment to create intermediate appellate courts narrowly fails.1904November 8: Constitutional amendment creating Courts of Appeal passes with 72 percent of the vote.1905April 10: Nine justices appointed by Governor George C. Pardee to serve in the three appellate districts.1906November: Justices elected to serve 12-year terms; staggered terms abolished.1907January: Justices take ofﬁce; salaries raised to $7,000.1919Divisions added to First and Second Appellate Districts.1928Article VI amended to permit continued creation of divisions and to give Legislature power to create districts and divisions.1929Fourth Appellate District created; sessions held in San Bernardino, San Diego, and Fresno.1961Fifth Appellate District created; sessions held in Fresno.1981Sixth Appellate District created; sessions held in San Jose.7 IntroductionPart 1—First Appellate DistrictThe First Appellate District is the oldest of the six appellate districts and is composed of the counties of Alameda, Marin, Napa, San Francisco, San Mateo, and Santa Clara. It is the largest of the"
https://www.courts.ca.gov/documents/coa100panels.pdf,
https://www.courts.ca.gov/documents/PragerSpeech.pdf,"The California Courts of Appeal were created in 1905 in response to the population growth and economic changes of the early 20th century. This new system of appellate courts was designed to address the delays in considering appeals that had been a problem since the second constitutional convention. The creation of the Courts of Appeal also helped to reduce corruption in the judiciary, allowed the Supreme Court to consider fewer cases in greater depth, and enabled a greater reflection of diversity in the California judiciary."
https://www.courts.ca.gov/documents/ShermanSpeech.pdf,"This article celebrates the 100th anniversary of the Court of Appeal in California. It highlights the important role the court plays in providing finality to disputes, developing the law, and providing guidance for people to regulate their behavior. It also mentions the late Bernard E. Witkin, who was instrumental in founding the court and developing the rules of appeal. Finally, the article ends with a toast to the court and those who have served it."
https://www.courts.ca.gov/documents/Steiner.pdf,"This is an overview of the history of the California Court of Appeal's system of appointing appellate counsel for indigents. It explains how the system has evolved since the 1960s, when there was little quality control, to the present day, where there are statewide guidelines and organizations such as the California Appellate Project and Appellate Defenders, Inc. to ensure quality representation. It also acknowledges the hard work of the attorneys who take appointments from the court and the justices who have supported the system."
https://www.courts.ca.gov/documents/AGRecordCourtsofAppeal.pdf,
https://www.courts.ca.gov/documents/2DCA-externprogram.pdf,"The Court of Appeal in Los Angeles offers first- and second-year law students the opportunity to gain an understanding of the appellate decision-making process by participating in the work of a judicial chambers. This includes reviewing appellate briefs, conducting legal research, and drafting opinions and memoranda. There is also a seminar component that teaches externs about the appellate process, opinion-writing techniques, and more. Applications for the summer program must be submitted between December 1, 2022 and February 15, 2023."
https://www.courts.ca.gov/documents/2023-Oral-Argument-Calendar-Dates.pdf,"This is a calendar of dates for the Court of Appeal, Second Appellate District in 2023. It includes dates for the months of January through December and also lists some important Jewish holidays. It is important to note that dates are subject to change and should be confirmed with the Clerk's Office."
https://www.courts.ca.gov/documents/2DCA-In-Person-OA-Guidelines.pdf,"The Second District Court of Appeal is providing a live video and audio feed of oral arguments due to concerns for the health and safety of the public and court employees. Only arguing counsel and one co-counsel are allowed in the courtroom, and all must wear masks and observe physical distancing. If any counsel or co-counsel show symptoms or test positive for COVID-19 within five days after being present at the court, they must call the Clerk's Office. These guidelines may be subject to change."
https://www.courts.ca.gov/documents/mc500.pdf,"This form is used by media agencies to request permission to photograph, record, or broadcast court proceedings. It must be filed at least five court days before the proposed coverage date. The form includes information about the media agency, the case, and the type of coverage requested. The media agency must also certify that all personnel will abide by the court's rules and any additional restrictions imposed by the court. A hearing may be held to discuss the request."
https://www.courts.ca.gov/documents/mc510.pd.pdf,"This document is an order from a court that permits a media agency to cover a specific case. The order considers factors such as the importance of maintaining public trust in the judicial system, the privacy rights of participants, and the effect of coverage on witnesses. It also outlines restrictions on media personnel and equipment, such as the number of cameras and microphones, and prohibits coverage of certain proceedings. Violations of the order may result in sanctions."
https://www.courts.ca.gov/documents/2DCA_DIV_5_JUNE_29_CAL_AM.pdf,
https://www.courts.ca.gov/documents/2DCA_DIV_5_JUNE_29_CAL_PM.pdf,
https://www.courts.ca.gov/documents/2DCA_DIV_5_JUNE_30_CAL_AM.pdf,
https://www.courts.ca.gov/documents/notice_to_litigants.pdf,"In order to appeal a court decision, you must present an adequate record of the trial court and an adequate opening brief that includes identifiable issues and arguments that cite the record and legal authorities. You must also provide transcripts of any evidence that you believe is insufficient or unbelievable. If you do not present a complete record and understandable arguments, you may waive or forfeit your issue."
https://www.courts.ca.gov/documents/2DCA-01.pdf,This is a form used by attorneys in California to extend the time to file briefs in a court of appeal case. It is not relevant to high school students.
https://www.courts.ca.gov/documents/2DCA-Copy_Service.pdf,This list provides information about commercial vendors that offer copying services. These vendors are located in different states and can provide cost estimates. This list should not be seen as an endorsement by the Court.
