url,text,date
https://www.courts.ca.gov/2523.htm,"Associate Justice, February 1989-February 2009
Rodney Davis was nominated by Governor George Deukmejian in 1989 to serve as an associate justice for the California Court of Appeal, Third Appellate District. He was confirmed by the Commission on Judicial Qualifications and elected to a full term in November of the following year.
Prior to serving on the Court of Appeal, Justice Davis served as a trial judge for the Sacramento Superior Court from 1985-1989, and for the Sacramento Municipal Court from 1983-1985. During his judicial career, he served as Justice Pro Tempore for the California Supreme Court and Presiding Special Master for the Commission on Judicial Performance. He also served as Chair of the Judicial Council's Appellate Indigent Defense Oversight Advisory Committee and Chair of the California Judges Association's Judicial Discipline Committee.
Before becoming a judge, Justice Davis served under three attorneys general while working for the California Department of Justice. Under John Van de Kamp, he served as Chief of the statewide Medi-Cal Fraud Unit, which consisted of over 90 lawyers, investigators, auditors, and support staff. Under George Deukmejian, he served as Supervising Deputy of the Medi-Cal Fraud Unit's Sacramento and San Francisco regional offices. Under Evelle Younger, he served as a prosecutor in the Criminal Division. During his career with the Department of Justice, Justice Davis served five months as an acting district attorney for Sierra County and as a Special Assistant for the U.S. Attorney, Northern District of California.
Justice Davis received a bachelor's degree from UC Davis in 1971. That fall, he moved to San Francisco where he received his law degree from the University of California, Hastings College of Law in 1974. While there, he served on the staff of the Hastings Constitutional Law Quarterly. In 1979 he received a master's degree in public administration from the University of Southern California. He completed judicial training programs at New York University Law School's Appellate Institute, California's Witkin Judicial College, and Kansas University's Law and Organizational Economics Center.
Justice Davis authored over 200 published opinions on subjects ranging from the constitutionality of unitary taxation of foreign corporations to grazing rights of cattle located on the remaining open ranges in California. He published articles in legal periodicals for organizations such as the American Bar Association, the American Judges Association, and the California Judges Association. He lectured for the UC Davis Leadership Development Series (Exercising Leadership Through the Initiative Process) and Sacramento Judicial Training (Ethics for the Judges Pro Tempore). He also taught courses for California's Center for Judicial Education and Research, the California Judges Association, The Rutter Group, and California's Continuing Education of the Bar.
Born in 1949 in Sacramento, California, Justice Davis was raised in Sacramento and Plumas counties. He is the son of former Assemblywoman Pauline Davis and former Assemblyman Lester Davis, and the husband of Susan Baxter Davis. They have two sons, Kevin and Brian. His community activities included serving as vice-president of the River City Youth Soccer League, club manager of the Del Dayo Soccer Club, board member of Saint Michael's Episcopal Day School, and senior warden of Saint Michael's Episcopal Church. In 2001, UC Davis selected Justice Davis as the recipient of its Jerry W. Fielder Award for contributions to the University, its alumni, and Foundation. He also was awarded the UC Davis Citation for Excellence. Justice Davis was president of the UC Davis alumni association, trustee of the UC Davis Foundation, Chair of the UC Davis Health System's Leadership Council and member of the Health System's Bioethics and Clinical Pastoral Services Advisory Boards. He was also president of the UC Davis Milton Schwartz Chapter of the American Inns of Court, an organization promoting ethics and civility in the legal profession.
Justice Davis retired from the Court in February 2009 to become an Episcopal priest in the Diocese of Northern California. His masters of divinity degree is from Church Divinity School of the Pacific, the Episcopal Church's western seminary located in Berkeley, California.",02/1989-02/2009
https://www.courts.ca.gov/2732.htm,"Presiding Justice, April 1905 - May 1921
Born March 7, 1836, at Milford Center, Ohio, Norton Parker Chipman was educated at Washington College and Cincinnati, Ohio, Law School (1859). After admission to the bar of Iowa in 1859, he practiced law there until the outbreak of the Civil War in 1861, when he enlisted in Company ""H"", Iowa Infantry. Chipman was seriously injured and reported as dead at Fort Donelson in 1862, but he did, in fact, survive. After he recuperated, he was assigned to special duty in Washington, and was on Lincoln's staff at Gettysburg. As judge advocate, Chipman prosecuted Captain Wirtz, commander of the heinous Andersonville Prison. Chipman's account of the trial was published in 1911 under the title ""The Tragedy of Andersonville."" After the war, President Grant appointed Chipman Secretary of the District of Columbia; he was later elected to Congress from that district in 1871, and served two terms. He was one of the founders of the Grand Army of the Republic, and authored the order creating Memorial Day. In 1876, Chipman moved to Red Bluff, California, where he practiced law, farmed, and for 15 years served on the State Board of Trade. In 1897, he was appointed Commissioner of the Supreme Court, a position he held until the commission was disbanded and replaced by the District Courts of Appeal. He was appointed by Governor Pardee to serve as presiding justice of the newly created appellate court, a position he held until his retirement May 2, 1921. Justice Chipman died in his home in San Francisco, February 1, 1924.",04/05/1905-05/02/1921
https://www.courts.ca.gov/4659.htm,"Associate Justice, May 1980 - January 1992
A pioneer and champion for women on the bench, Frances Carr was born in El Centro, California, October 27, 1923. One of four children of itinerant farm workers, she worked her way through college (University of California, Berkeley (AB, 1945), and Boalt Hall (JD, 1948) in a variety of jobs including nightclub photographer and laborer building Liberty ships in Kaiser shipyards. She also spent a year (1944) as a radio announcer in Missoula, Montana. Admitted to the California Bar on January 11, 1949, Carr practiced law in Antioch, California, before moving to Sacramento in 1950. In December 1975, she became the first woman to be appointed to the bench of the Superior Court, Sacramento County, where she also served as presiding judge from 1978 to 1979. In 1980, she was appointed to the Court of Appeal, Third Appellate District. Justice Carr died suddenly, at home, January 16, 1992, six weeks before she was to have retired.",05/1980-01/1992
https://www.courts.ca.gov/2723.htm,"Associate Justice, April 1905 - January 1907
Abraham Jay Buckles was born near Muncie, Indiana, on August 2, 1846. Buckles was largely self-educated. When war broke out in 1861, he joined Company E, 19th Indiana Infantry, which was to become part of the ""Iron Brigade"" of the Army of the Potomac. Wounded numerous times in several notorious Civil War battles, Buckles’ right leg was amputated after being shot through the knee at the Hatchin Run, March 25, 1865, just 15 days before Lee's surrender. Buckles received a Congressional Medal of Honor. After his discharge as a second lieutenant, he became a teacher while he read the law. He was admitted to the Bar in 1875 and moved to Dixon, California, where he began his legal career. In 1879, he was elected District Attorney of Solano County, a position he retained until 1884, when he became Judge of the Superior Court of Solano County. Governor Pardee named Buckles to the newly created Court of Appeal, Third Appellate District, in April 1905. Buckles denied nomination for election to the appellate court in 1906, and left office upon the expiration of his term in 1907. He returned to practice in Fairfield, and in 1908 returned to the bench of the Superior Court of Solano County, where he served for the remainder of his life. He died 11 days after an operation in Ramona Hospital in San Bernardino County on January 19, 1915.",04/1905-01/1907
https://www.courts.ca.gov/2727.htm,"Associate Justice, December 5, 1996 - May 28, 2003
The stylish and vivacious Connie Callahan was born June 9, 1950 in Palo Alto, California. She graduated from Stanford University with a degree in English in 1972, and received her JD from Pacific McGeorge School of Law in 1975, and received her LLM from the University of Virginia School of Law in 2004. She worked first as a Deputy City Attorney for the City of Stockton and then as a Deputy District Attorney for the San Joaquin County District Attorney's Office until 1986, when she was appointed Commissioner of the Municipal Court for Stockton Municipal Court. In 1992 she was appointed to the Stockton Superior Court, and in 1996 was elevated to the Third District Court of Appeal. She left the Third DCA in May 2003 to accept an appointment to the United States Court of Appeals for the Ninth Circuit, where she currently serves.",12/05/1996-05/28/2003
https://www.courts.ca.gov/2725.htm,"Associate Justice, January 1907 - August 1923
Born April 9, 1856, in Polk County, Oregon, Albert Glenn Burnett (nephew of Peter H. Burnett, first governor of California) moved to California with his family when he was two years old. He attended Christian College in Santa Rosa and taught school in Sonoma County (principal of Healdsburg public school, and Petaluma grammar and high schools) for nearly 10 years while studying the law. He was admitted to the California Bar in 1887, settled in Santa Rosa, and the following year was elected District Attorney of Sonoma County. In 1896 he was elected Judge of the Superior Court of Sonoma County. On November 6, 1906, he was elected Associate Justice of the Court of Appeal, Third Appellate District, where he served until his death in August 1923.",01/07/1907-08/23/1923
https://www.courts.ca.gov/2520.htm,"Justice Butz was born in Auburn, California in 1950. She spent her junior year of high school as an American Field Service (AFS) International exchange student to Brazil. She graduated from Placer Union High School in Auburn in June 1968. Following graduation, she attended the University of California at Davis, where she obtained her B.A. degree in 1972.
After working for several years in the School of Engineering and Shields Library at the University of California at Davis, she attended the UC Davis School of Law. She obtained her J.D. from that school in 1981. She was admitted to the California Bar on June 10, 1982.
Justice Butz was in private practice in Nevada City, California, from 1982 to 1996. During that period she was an associate in the law firm of Berliner & Spiller, and partner in the successor firm of Spiller, McProud, Butz & Kraemer. On November 5, 1996, she was elected to the Nevada County Superior Court. She was reelected to a second term in 2002. She served as presiding judge of the Nevada County Superior Court in 2001-2002, presiding judge of the Family & Juvenile Court for Nevada County in 2003, and supervising judge of the Nevada County Civil Grand Jury from 1997 to 1999. As a trial judge, she presided over civil, criminal, probate, family, and juvenile delinquency and dependency cases.
In October 2003, Justice Butz was elevated by Governor Gray Davis to associate justice in the Court of Appeal, Third Appellate District. She was retained by California voters in 2006 and 2010.
Justice Butz has served as an instructor of judicial education for the California Center for Judicial Education and Research (CJER) and the B. E. Witkin Judicial College of California (1998-2003). She served as chair of CJER's Rural Courts Education Committee (2003-2004) and as a member of the Appellate Justices Education Committee (2004-2009). She served as a member of the Judicial Council's Appellate Indigent Defense Oversight Advisory Committee (2005-2016), CJER's Appellate Practice Curriculum Committee (2010-2012), and the Executive Board of the California Judges Association (2011-2014). She has Chaired the Appellate Mediation Committee of the Third District Court of Appeal from 2011 to the present.
Justice Butz is a Past President of the Schwartz / Levi American Inn of Court, an organization promoting civility, ethics, and professionalism in the legal profession (2012-2015).
Married with a large extended family, Justice Butz is an avid reader, and enjoys travel and leisure time with family and friends.
Justice Butz retired from the Court in 2020.",11/05/1996-08/31/2020
https://www.courts.ca.gov/2721.htm,"Associate Justice, November 1994 - May 1996
[Retired from the federal bench on August 31, 2017]
Janice Rogers Brown was born May 11, 1949 in Greenville, Alabama, and was educated at California State University, Sacramento (BA, 1974), and UCLA (JD, 1977). She was admitted to the California Bar December 28, 1977, and worked as Deputy Legislative Counsel from 1977-79, Deputy Attorney General, from 1979-1987, and Deputy Secretary and General Counsel for the California Business, Transportation, and Housing Agency, 1987-1989. From 1989-1991, she worked in private practice. In 1991 she became Legal Affairs Secretary to Governor Wilson, a position she held until her appointment to the Court of Appeal, Third Appellate District, November 4, 1994. She was elevated to the California Supreme Court May 3, 1996, where she served until June 8, 2005, when she assumed her position on the United States Court of Appeals for the District of Columbia Circuit.",11/04/1994-06/08/2005
https://www.courts.ca.gov/2673.htm,"Presiding Justice, May 1942 - November 1952
An extraordinary woman and true trailblazer, Annette Abbott Adams was one of the first women school principals in California, one of the first two women to receive a law degree from the University of California, one of the first women to be admitted to the California Bar, the first woman to serve as a U.S. Attorney, the first woman appointed Assistant U.S. Attorney General, and the first woman to serve as an appellate court justice in California. She was born March 12, 1877, in Prattville, Plumas County, and attended Chico State Normal School, University of California, Berkeley (BL, 1904), and Boalt Hall (JD, 1912). Adams taught grammar school and was principal of Modoc County High School, Alturas, prior to her career in law. Admitted to the California Bar in 1912, she practiced law in Quincy, and then in San Francisco, before becoming Assistant U.S. Attorney, 1914-18, and U.S. Attorney, 1918-20. After serving as Assistant U.S. Attorney General, 1920-21, she returned to San Francisco and practiced law there until 1935, when she was appointed Assistant Special Counsel of U.S. oil litigation. In March 1942, she became California's first female appellate justice when Governor Olson appointed her Presiding Justice of the Court of Appeal, Third Appellate District. Justice Adams retired December 1952; she died at her Sacramento home four years later, October 26, 1956.",05/01/1942-12/01/1952
https://www.courts.ca.gov/75426.htm,"Shama Hakim Mesiwala is a native Californian, born in Stanford in 1974 and raised in Cupertino among the fruit orchards and burgeoning technology industries of Silicon Valley. Her father immigrated from Mumbai, India in the 1960’s for educational opportunities and freedoms found only in America. She attended all public schools, graduating from UC San Diego magna cum laude in three years. She started law school at UC Davis King Hall at age 20 and graduated in 1998. Justice Mesiwala devoted her legal career to public service. She represented indigent criminal defendants at the Office of the Federal Public Defender in Sacramento and the Central California Appellate Program, where she argued cases before the California Supreme Court and California Courts of Appeal. Justice Mesiwala then transitioned to working for the judiciary. She was a central staff attorney at the California Court of Appeal, Third Appellate District for one and a half years, followed by a chamber’s attorney for Justice Ronald B. Robie for 11 years. She was appointed commissioner in 2017 and 10 months later, judge of the Sacramento County Superior Court. In her six years on the trial court, Justice Mesiwala presided over criminal jury trials, civil jury trials, civil bench trials, civil law and motion, civil settlement conferences, preliminary hearings, juvenile dependency, drug court, mental health hospital hearings, state hospital hearings, civil harassment restraining order hearings, collaborative courts, and small claims. She created Northern California’s first Indian Child Welfare Act courtroom. And she served as the Americans with Disabilities (ADA) judge for the Hall of Justice.
On Valentine’s Day 2023, Justice Mesiwala was unanimously confirmed as an associate justice on the California Court of Appeal, Third Appellate District, having been nominated by Governor Gavin Newsom on December 23, 2022. She was rated exceptionally well qualified, the highest rating given by the Commission on Judicial Nominees Evaluation (JNE).
Justice Mesiwala is also active in the community. She has been professor of Appellate Advocacy to over 650 students at UC Davis Law School for a decade; president of the Schwartz/Levi American Inn of Court; cofounder of the South Asian Bar Association of Sacramento and host of its annual Diversity Law Student Reception for 15 years; and member of the California Supreme Court Ethics Opinion Committee. For her community service, Justice Mesiwala has received the UC Davis Law School’s pro bono certificate, the Unity Bar community service award, the Women Lawyers of Sacramento Frances Newell Carr award, the King Hall Legal Foundation’s judge of the year award, and named a Sacramento Bee top 25 Asian American/Pacific Islander change maker.
Justice Mesiwala lives in Yolo County with her spouse of 20 years and their lively son.",02/17/2017-02/14/2023
https://www.courts.ca.gov/48234.htm,"Justice Stacy E. Boulware Eurie was unanimously confirmed as an Associate Justice of the Court of Appeal, Third Appellate District on August 4, 2022, following her appointment by Governor Gavin Newsom. Previously, she served as a trial judge on the Sacramento Superior Court for 15 years, presiding over civil, criminal and appellate matters and where she served as Presiding Judge of the Juvenile Court from 2010-2018.
Prior to her tenure on the trial court, Justice Boulware Eurie was Senior Assistant Attorney General, the statewide head of the Government Law Section at the Attorney General’s Office, where she was counsel to the State’s constitutional officers and the California court, having previously served in other various roles within in the office from 2000 to 2006. Justice Boulware Eurie also served as an associate attorney at Rothschild, Wishek & Sands LLP from 1996 to 2000.
Justice Boulware Eurie has been an active member of California’s legal community for more than 25 years. She served on the California State Bar’s Litigation Section’s Executive Committee, was a board member of the Women Lawyers of Sacramento for more than a decade, and she is a former President of the Sacramento County Bar Association. Justice Boulware Eurie was an executive member of the Commission on the Future of California’s Court System, the Judicial Council of California, and the California Child Welfare Council. For more than 10 years, Justice Boulware Eurie has served as faculty through the Judicial Council’s Center for Judicial Education and Research on a wide range of substantive and administrative topics and has helped lead statewide and national collaborations on human trafficking and truancy. She continues to dedicate significant time to engaging California’s youth through the Chief Justice’s Power of Democracy Steering Committee and through other local civic learning organizations. Justice Boulware Eurie has been the recipient of numerous awards, including the California Judges Association Juvenile Court Judge of the Year in 2014, the Sacramento County Bar Association Judge of the Year for 2020, the Chief Probation Officers of California Judge of the Year for 2015, and the Wiley Manuel African American Bar Association of Sacramento Judge of the Year in 2010 and 2022. Justice Boulware Eurie received a Bachelor of Arts degree from the University of California, Los Angeles, and a Juris Doctor degree from the University of California, Davis.",08/04/2022-N/A
https://www.courts.ca.gov/2517.htm,"Justice Blease has served as an Associate Justice of the Court of Appeal, Third Appellate District since he was appointed by Governor Brown in 1979. He also served as a justice pro tem on the California Supreme Court (1982, 1997, 2005), a former member and Vice Chairman of the California Center for Judicial Education, and a Special Master for the Commission on Judicial Performance (1996). He is a past President and a Master of the Milton Schwartz Inn of Court.
Justice Blease also has been a member of the Select Committee of Advisors, Pacific Law Journal, a consultant to California Civil Appellate Practice, 3d ed., 1996, a moderator of Continuing Education of the Bar programs on appellate review, civil writs, criminal appeals and evidence and a speaker at Sacramento County Bar Committees on Administrative and Labor Law. Justice Blease was a participant in the Appellate Judges Seminar, Advanced Series, Institute of Judicial Administration, New York University School of Law in 1996. He is the author of a paper on the strict construction of statutes which has been delivered to judges and lawyers.
Justice Blease is the author of more than 3000 opinions on a broad array of subjects, several hundred of which have been published, including a dozen on water law. Among them are County of Inyo v. City of Los Angeles (1981) 124 Cal.App.3d 1 [pumping of water from Owens Valley], California Trout, Inc. v. State Water Resources Control Board (1989) 207 Cal.App.3d 585 [release of water into streams tributary to Mono Lake], Baldwin v. County of Tehama (1994) 31 Cal.App.4th 166 [county regulation of groundwater] and Central Delta Water Agency v. State Water Resources Control Board (2004) 124 Cal.App.4th 245 [jurisdiction of state water board]. He has been an annual participant in national conferences for water masters and judges since 1999.
Justice Blease received his undergraduate (1952) and law degrees (1955) from the University of California at Berkeley where he later taught undergraduate courses in freedom of speech and the logic of argument. Before appointment to the bench he represented civil rights organizations and had a varied practice in public law. His clients included the California Teachers Association, the State Superintendent of Public Instruction, the County of Placer, the League to Save Lake Tahoe and public employee organizations. He argued some forty cases before the appellate courts of California, Nevada and the federal Ninth Circuit Court of Appeals.
Justice Blease was born in 1929 and is married to Barbara Blease, an advocate for persons with disabilities. They frequently hike in the Sierra mountains during the summer. They have two grown sons Christopher and Brian, one a businessman and the other a biologist. Justice Blease retired from the Court in 2022.",1979/01/01-2022/12/31
https://www.courts.ca.gov/47945.htm,"Justice Laurie M. Earl was appointed to California’s Third District Court of Appeal by Governor Gavin Newsom in November of 2021 and unanimously confirmed by California’s Commission on Judicial Appointments on January 6, 2022. Prior to her elevation to the Court of Appeal, Justice Earl served as a Judge on the Sacramento County Superior Court between 2005 and 2021, where she presided over civil, criminal and juvenile dependency cases. Justice Earl also served as the Sacramento Superior Court’s Presiding Judge between 2012 and 2013.
Justice Earl has served on a number of statewide committees, most notably she served as Chair of the Judicial Council of California’s Trial Court Presiding Judge Advisory Committee (2012-13) and Chair of the Judicial Council of California’s Trial Court Budget Advisory Committee (2012 – September, 2015). Upon appointment by the Chief Justice of California, Judge Earl has served as a member of the Commission of the Future of California’s Court System (2014), as a Special Master to the California Commission on Judicial Performance (2019) and as a member of the California Supreme Court’s Jury Selection Workgroup (2020). Justice Earl teaches Criminal Law Pleading and Practice at her alma mater, Lincoln Law School of Sacramento and has been an instructor of judicial education in both criminal law and ethics courses.
Justice Earl has been recognized as Alumnus of the Year by Lincoln Law School of Sacramento, as Judge of the Year by both the Capitol City Trial Lawyers Association in 2010 and the Sacramento County Bar Association in 2013. She received the Founders Award from the Sacramento Lawyers for the Equality of Gays and Lesbians (SacLegal) Bar Association in 2013. Also in 2013 Judge Earl received the Judicial Council of California’s highest recognition, the Ronald M. George Award for Judicial Excellence, in recognition of her leadership in working with trial court judges and executive officers in developing a methodology that changed the way state trial court funding is allocated to each of the 58 trial courts.",11/2021-01/2022
