url,title,district,division,role,image,body,date,ocr
https://www.courts.ca.gov/documents/AbbeR.pdf,Richard W. Abbe,2nd District Court of Appeal,Division 6,Associate,https://www.courts.ca.gov/images/AbbeR.jpg,"Richard W. Abbe
Associate Justice, Division 6
December 27, 1982 to November 30, 1990

Born on January 6, 1926 in Paris, France
Died September 3, 2000 in Berkeley, CA

EDUCATION
LL.B., Hastings College of Law, 1953
B.A., Stanford University, 1950
State Bar Admission: 1954

JUDICIAL EXPERIENCE
Associate Justice, California Court of Appeal, Second Appellate District, Division 6
December 3, 1982 – November 30, 1990, Appointed by Governor Edmund G. Brown, Jr.
Judge, Shasta County Superior Court
1965 - 1982, Appointed by Governor Edmund G. Brown, Sr.

PROFESSIONAL BACKGROUND
District Attorney, Shasta County, 1962 - 1965
Deputy Attorney General, Shasta County, 1960 - 1962
Private Practice, Hollister, San Benito County, 1954 – 1959
U.S. Navy, World War II, 1943 - 1946

NOTE
His father, James Abbe, was a professional international photographer and his mother was a Ziegfield Follies dancer.",12/27/1982-11/30/1990,"Richard W. Abbe 
Associate J ustice, Div ision 6 
December 2 7, 1982 to November 30 , 1990 
 
 
 
 Born on January  6, 1926 in Paris, France  
 Died September 3, 20 00 in Berkeley , CA 
 
EDUC ATION 
 
 LL.B., Hastings College of Law, 1953 
 B.A., Stanford Universit y, 1950   
 
 State Bar Ad mission: 1954 
 
 
 
JUDIC IAL EX PERIEN CE 
 
 Associate Ju stice , California Court of Appeal, Second Appellate District, Division 6 
 December 3, 1982  – Nove mber 30, 19 90, Appointed by Governor Edm und G. Brown, Jr. 
 
 Judge , Shasta Count y Superior Court 
 1965  - 1982, Appointed by Governor Ed mund G. Brown, Sr. 
 
PROFESSIONAL BACKGROUND 
 
 District Attorney , Shasta Count y, 1962 - 196 5 
 
 Deputy Attorney Gene ral, Shasta Count y, 1960 - 1962 
 
 Private Practice ,  Hollister, San Benito Count y, 1954 – 1959 
 
 U.S. Navy , World War II, 194 3 - 1946 
 
NOTE
 
             His father, James A bbe, was a professional international photographer 
and his mother was a Ziegfield Follies dancer."
https://www.courts.ca.gov/documents/AisoJ.pdf,John F. Aiso,2nd District Court of Appeal,Division 5,Associate,https://www.courts.ca.gov/images/AisoJ.jpg,"John F. Aiso
Associate Justice, Division 5
November 4, 1968 - December 31, 1972

Born December 14, 1909 in Burbank, California
Died December 29, 1987 at the age of 78 in Burbank, California from injuries sustained in an attempted mugging in Hollywood, CA.

EDUCATION
LL.B., Harvard Law School, 1934
B.A. cum laude, Brown University, 1931
Studied Japanese law at Chuo University in Tokyo

State Bar Admission: January, 1941

JUDICIAL EXPERIENCE
Associate Justice, California Court of Appeal, Second Appellate District, Division 5 
November 4, 1968 - December 31, 1972, Appointed by Governor Ronald Reagan

Judge, Los Angeles Superior Court
September 11, 1957 - November 1968, Appointed by Governor Goodwin J. Knight

Judge, Los Angeles Municipal Court
September 1953 - September 1957, Appointed by Governor Earl Warren

PROFESSIONAL BACKGROUND
Special Counsel, O’Melveny & Meyers, 1972-1983
Private Practice, 1947 - 1953
Lieutenant Colonel, U.S. Army, 1941 - 1947
Private Practice, 1934","- 1941

11/04/1968-12/31/1972","John F. Aiso 
Associate J ustice, Div ision 5 
November 4, 1968 - December 31, 1972 
 
 
 Born Decem ber 14, 19 09 in Burbank, Cal ifornia 
 Died Decem ber 29, 19 87 at  the age of 78  in Burbank ,   
 California from  injuries sustained in an a ttempted  
 mugging in H ollywood, CA. 
 
EDUC ATION 
 
 LL.B., Harvard Law School, 19 34 
 B.A. cum laude , Brown University, 1931 
 Studied Japanese la w at Ch uo University in Tokyo 
 
 
 State Bar Ad mission: January , 1941 
 
 
JUDIC IAL EX PERIEN CE 
 
 Associate Ju stice , California Court of Appeal, Second Appellate District, Division 5  
 Novem ber 4, 1968  - Decem ber 31, 19 72, Appoi nted by Governor Ronald Reagan 
 
 Judge , Los A ngeles Superior Court 
 Septem ber 11, 195 7-Nove mber 1968, A ppoint ed by Governor Go odwin J. Kni ght  
 
 Judge , Los A ngeles Municipal Court  
 Septem ber 1953 - Septem ber 1957, Ap pointed b y Governor Earl Warren 
 
PROFESSIONAL BACKGROUND 
 
 Special Counsel , O’Melveny  & Me yers, 1972- 1983 
 
 Private Practice , 1947 –  1953 
 
 Lieutenant Colonel , U.S. Arm y, 1941 – 1947 
 
 Private Practice , 1934 –  1941 
 
 NOTE 
 
 Justice Aiso was the first Japanese-American to hold a judicial position in the contiguous 
United States."
https://www.courts.ca.gov/documents/AlarconA.pdf,Arthur L. Alarcon,2nd District Court of Appeal,Division 4,Associate,https://www.courts.ca.gov/images/AlarconA.jpg,"Arthur L. Alarcon
Associate Justice, Division 4
June 8, 1978 to November 20, 1979

Born August 14, 1925 in Los Angeles, California

EDUCATION

LL.B., University of Southern California Law School, 1951 (Law Review)
B.A., University of Southern California, 1949
University of California, Los Angeles, 1946-1948

State Bar Admission January 9, 1952

JUDICIAL EXPERIENCE

Senior Judge, U.S. Court of Appeals, Ninth Circuit
November 20, 1979 - Present, Nominated by President Jimmy Carter

Associate Justice, California Court of Appeal, Second Appellate District, Division 4
June 8, 1978 - November 20, 1979, Appointed by Edmund G. Brown, Jr.

Judge, Los Angeles Superior Court
July 1, 1964 – June 8, 1978, Appointed by Edmund G. Brown, Sr.

PROFESSIONAL BACKGROUND

Career Executive Secretary, Governor Edmund G. Brown, Sr., 1962 - 1964

Legal Advisor, Clemency and Extraditions, 1961 - 1962

Director, Special Study Commission on Narcotics, 1960 - 1961","Deputy Attorney General, State of California, 1958 - 1960

Deputy City Attorney, Los Angeles, 1953 - 1958

Private Practice, Los Angeles, 1952 - 1953

06/08/1978-11/20/1979","Arthur L. Alarcon 
Associate J ustice, Div ision 4 
June 8, 1978 to November 20, 1979 
 
 Born August 14, 1 925 in L os Angeles, California 
 
EDUC ATION 
 
 LL.B., University  of Sout hern California Law School, 1951 
  L aw Review 
 B.A., University of So uther n California, 1949 
 University  of California, Los Angeles, 1946-1 948 
 
 State Bar Ad mission January  9, 1952 
 
  
JUDIC IAL EX PERIEN CE 
 
 Senior Judge , U.S. Court of Appeals, Ninth Circuit 
 Nove mber 20, 1979 - Present, Nom inated by President Ji mmy Carter 
  
 Associate Ju stice , California Court of Appeal, Second Appellate District, Division 4 
 June 8, 19 78 - Novem ber 20, 19 79, Ap pointed b y Edmund G. Brown, Jr. 
 
 Judge , Los A ngeles Superior Court 
 July 1, 1964 – June 8, 1978, Appoi nted by Edm und G. Brown, Sr. 
  
PROFESSIONAL BACKGROUND 
 
 Caree r Executive Secretary , Governor Edm und G. Brown, Sr., 19 62 - 1 964 
  
 Legal Advisor , Clem ency  and Extraditi ons, 19 61 - 1962 
  
 Directo r, Special Study  Commission on Narcotics, 1960 - 1961 
 
 Deputy Distr ict Attorney , Los Angeles Count y, 1952 - 196 1 
  
 Private Practice , 1952 (fo r 2 m onths) 
 
 Staff Sergeant , U.S. Army, 1943 – 1946 (Honors: 4 Battle Stars)"
https://www.courts.ca.gov/documents/AldrichR.pdf,Richard D. Aldrich,2nd District Court of Appeal,Division Three,Associate,https://www.courts.ca.gov/images/AldrichR.jpg,"Division Three: JUSTICE RICHARD DENNIS ALDRICH

PROFESSIONAL EXPERIENCE:
California Court of Appeal, 1994 - 2017 (Ret.).
Associate Justice of the California Court of Appeal, Second Appellate District, Division Three, August 29, 1994 to June 30, 2017. Appointed by Gov. Pete Wilson.
Ventura County Superior Court, 1991 - 1994.
Judge of the Superior Court, County of Ventura, California, January 1991 to August 1994. Appointed by Gov. George Deukmejian.

In 1992, Judge Aldrich was instrumental in inaugurating Ventura County’s Multi-Door Courthouse. Patterned after a 1976 concept of Prof. Frank Sander of the Harvard Law School, this program provides litigants with multiple modalities for early resolution of their disputes without trial. These modalities include arbitration, mediation, settlement conferences and other procedures allowing early intervention by the judge to attempt to effect settlement before the expenditure of time and expense of protracted litigation. This program still exists in Ventura with a success rate of over 40% settlements without trial.

In 1992 Judge Aldrich was the recipient of the “Trial Judge of the Year”","award from the Ventura County Bar Association.

Appointment Date: 08/29/1994
Resignation Date: 06/30/2017","Division Three: JUSTICE RICHARD DENNIS ALDRICH  
 
 
PROFESSIONAL EXPERIENCE:  
 
California Court of Appeal, 1994 -2017 (Ret .). 
 
Associate Justice of the California Court of Appeal , Second 
Appellate District, Division Three, August 29, 1994 to June 30, 2017 .  
Appointed by Gov. Pete Wilson.  
 
Ventura County Superior Court, 1991 -1994.  
 
Judge of the Superior Court, County of Ventura, California, January 1991 
to August 1994.  Appointed by Gov. George Deukmejian.  
 
In 1992, Judge Aldrich was instrumental in inaugurating  Ventura 
County’s Multi -Door Courthouse .  Patterned after a 1976 concept of 
Prof. Frank Sander of the Harvard Law School, this program provides 
litigants with multiple modalities for early resolution of their disputes without trial.  These modalities 
include arbitration, mediation, settlement conferences and other procedures allowing early intervention by 
the judge to attempt to effect settlement before the expenditure of time and expense of protracted 
litigation.  This program still exists in Ventura with a success rate of over 40% settlements without trial.  
 
In 1992 Judge Aldrich was the recipient of the “Trial Judge of the Year”  award presented by the 
Ventura County Trial Lawyers Association.  
 
In 1992 and again in 1993 Judge Aldrich was selected as the “Outstanding Jurist of the Year” by the 
Ventura County Bar Association . 
 
From 1992 to 1994 Judge Aldrich  was Chair of the “Alternative Dispute Resolution  Committee”  for the 
Ventura Courts and was the founding Chair of the “Bench, Bar Media Committee” .  This committee was 
started by Judge Aldrich to promote better understanding between the judiciary, the bar and the media.  
He also chaired the “Fiscal and Budget” and  “New Legislation and Rules Committees”.  
 
In February, 1993, Judge Aldrich, who is himself disa bled, fulfilled his promise to a meeting of 
“Employment of Attorneys with Disabilities” to make California the first state in the nation to adopt a 
mechanism for persons with disabilities using California Courts to ask for and receive special 
accommodation s permitting them greater access the our courts.  In early 1993, he composed the original 
draft a measure that was adopted by the California Judicial Council in 1996 as Rule of Court 983.3, 
“Requests for accommodations by persons with disabilities.”   Earlier, largely through the efforts of 
Justice Aldrich, a similar measure was adopted by the California State Bar Board of Governors.   
 
California Court of Appeal, 1994 to 2017 . 
 
Justice Aldrich was elevated to the California Court of Appeal, Second Appellate  District, Division Three 
in 1994  where he served until his retirement, June 30, 2017 .    
 
In 1994 , Chief Justice Malcolm Lucas appointed Justice Aldrich as Chair of the  Select Committee on 
Trial Court Coordination Implementation .  The findings and recomme ndations of this “blue ribbon” 
commission were the precursor to Trial Court Unification that now exists in all counties in California.  In 
1996 , Chief Justice Lucas appointed Justice Aldrich Chair of the Business Court Study Task  Force .  
This committee was  charged with investigating the desirability and the feasibility of establishing business  
courts in California.   
 In 1995 , Justice Aldrich was instrumental in inaugurating the “Second District Appellate Settlement 
Conference and  Mediation Program.”   Under  the auspices of the Alternative Dispute Resolution 
Committee, the program has recruited experienced appellate practitioners to act as mediators and 
settlement conference officers.  As a result of this program, each year over  30% of pending appeals are 
being resolved before the time and expense of briefing and preparation of the appellate record.  
 
In 1997 , Chief Justice Ronald M. George asked Justice Aldrich to Chair the  Complex Litigation Task 
Force  for the California Judicial Council.  This task force cre ated a program to facilitate the management 
and disposition of all types of complex litigation (including complex business and tort cases) in the courts 
of California.  Under the leadership of Justice Aldrich, the Task Force published a definitive  “Deskboo k 
on the Management of Complex Civil  Cases”  which has become the model against which other similar 
programs are evaluated by other state court systems across the nation.  The Task Force formulated 
California Rules of Court and  Standards of Judicial Adminis tration  to implement complex litigation 
programs in California courts and recommended statutory changes to the legislature.  The committee also 
established 6 pilot programs in major urban centers in California including Los Angeles, Orange, San 
Francisco, Alameda, Contra Costa and Santa Clara counties.  The Task Force in conjunction with the 
Center for Judicial Education and Research  also created curricula  to instruct trial judges in the most 
advanced case management techniques available to more efficiently  handle complex civil cases.  The 
goal of this project is to better serve the public by providing a fast, efficient and economical way to resolve 
complex civil disputes.  
 
From 1998 to 2002, Justice Aldrich was appointed by the Chief Justice to the Judicial  Council of 
California . The Judicial Council is the constitutionally created governing committee of the judicial branch 
of government charged with the operation and administration of all the courts in the state of California. 
During his tenure on the Judic ial Council, Justice Aldrich served as Vice -Chair of the Policy Committee  
and he also served on the Executive Committee  and the Rules and Projects  standing committees.  
 
Justice Aldrich chaired the Judicial Council’s Civil and Small Claims Standing Advisory  Committee, 
its Case Management and Delay Reduction subcommittee.  I n 1997 and again in 2003, Justice 
Aldrich Chaired the California Judicial Administration Conference .  He chaired the Blue Ribbon 
Panel of Experts on the Fair and Efficient Administration o f Civil Cases  in 2003.  This panel brought 
consensus among many competing legal constituencies to unify delay reduction standards to allow for 
faster and more efficient resolution of civil cases in the court system.  In 2004, he chaired the Court Fees 
Work ing Group  of the Judicial Council.  This committee established uniform statewide filing fees to 
equalize and more equitably distribute filing fee revenue in each of the 58 counties in California.  
 
From  2004  to 2007 , Justice  Aldrich was chair of the Judicia l Council’s  Court Security Working Group.  
This committee is composed of representatives from the courts, the legislature, security chiefs, the State 
Sheriff’s Association, labor unions and the public.  This committee has established uniform funding 
standa rds for court security throughout the state of California.   
 
For 19 years, from 1992 to 2011, Justice Aldrich was on the faculty of the B.E. Witkin California Judicial 
College  where he t aught  “Civil Settlement Techniques.”   This was an interactive class t hat was designed 
to enable even the novice civil judge to effectively conduct civil settlement conferences.  The highlight of 
the course was an actual settlement conference conducted by Justice Aldrich in front of the class with the 
actual lawyers and prin cipals involved in the case participating.   He has also taught and lectured to 
judges and attorneys in the United States and abroad.  
  
HONORS AND AWARDS  
 
Published in Best Lawyers in America , 1986, 1987, 1988, 1989.  
 
Published in California Lawyer Magazine , Sept. 1989 , “A Sampling  of California’s Most Respected 
Lawyers”.  
 
Recipient of American Board of Trial Advocates California  “Trial  Lawyer of the Year”  Award, 1990.  Recipient, Ventura County Trial Lawyers Association “Trial Judge of the Year”  award, 1992.  
 
In 1992 and 1993, named the outstanding jurist by the Ventura County Bar Association.   The criteria for 
this rating were legal knowledge, legal scholarship, settlement skills, demeanor, efficiency, decisiveness, 
impartiality, integrity, courage, and repu tation.  
 
In February 2000, Justice Aldrich was featured in the Los Angeles  Business Journal  in an article 
entitled “L.A.’s Most Powerful Judges.”  
 
Justice Aldrich received the Chief Justice Roger J. Traynor Appellate Justice of the Year Award, for 
the year  2000, from the Consumer Attorneys of Los Angeles .   
 
In 2006, Justice Aldrich received the highest honor given by the California Judicial Council, the  Jurist of 
the Year Award.  The award was presented to Justice Aldrich  for his extraordinary contribution s to the 
California court system and for his dedication to the highest principles of the administration of justice 
statewide.   
 
HONORARY LEGAL SOCIETIES AND ORGANIZATIONS  
 
 American College of Trial Lawyers, 1984 to Present.  
 In 1984 , Richard Aldrich was inducted as a Fellow of The American  College of Trial Lawyers.   
Membership in this prestigious organization is by invitation only and is limited to the top two percent of 
trial lawyers in the United States as determined by its membership.  He later served on the California 
State Committee of this organization for many years.  
 
 International Academy of Trial Lawyers, 1988 to Present.  
 In 1988 , he was inducted as a Fellow of The International  Academy of Trial Lawyers .  According to 
its bylaws, membership in t he Academy is by invitation only and is limited to 500 lawyers in the United 
States.  
  
 American Board of Trial Advocates, 1975 to Present.   
The American Board of Trial Advocates is a national organization of over 6,000 experienced trial 
attorneys with ch apters in all 50 states.  Membership is limited to only those attorneys who qualify by 
having tried a minimum number of jury  trials to a conclusion.   
President , Los Angeles Chapter  of The American Board of Trial Advocates, 1986 ; Vice President, 
1985 ; Secr etary, 1976;  Chair California ABOTA, 1986 , Los Angeles Executive Committee, 1981 to 
Present ; National Board of Directors, 1987 -1995 ; Chair  of Civil Justice Committee, 1987 -1991; 
National Chairperson Region 10 , 1992 -93, National Chair, Civil Justice Award C ommittee, 1992 -93. 
 
Member Emeritus, Board of Regents Loyola Marymount University , 2002 -Present; Chair, Board of 
Regents LMU, 1999 -2000, 2000 -2001; Vice -Chair , Board of Regents LMU, 1997 -1998, 1998 -1999. From 
2003 to 2006 Justice Aldrich served on the Boar d of Directors of the Association of Business Trial 
Lawyers ."
https://www.courts.ca.gov/documents/AllenM.pdf,Matthew T. Allen,2nd District Court of Appeal,Division 1,Associate,https://www.courts.ca.gov/images/AllenM.jpg,"Matthew Thompson Allen
Associate Justice, Division 1
April 10, 1905 to January 7, 1907
Presiding Justice, Division 1
January 7, 1907 to October 10, 1913

Born September 17, 1848, Greenville, Ohio
Died October 10, 1913

EDUCATION

Privately studied under Hon. D. M. Bradbury, Winchester, Indiana
Otterbein University, Westerville, Ohio

State Bar Admission: September 17, 1869, Indiana

JUDICIAL EXPERIENCE

Presiding Justice, California Court of Appeal, Second Appellate District, Division 1
January 7, 1907 - October 10, 1913

Associate Justice, California Court of Appeal, Second Appellate District, Division 1
April 10, 1905 - January 7, 1907

Judge, Los Angeles Superior Court
December 17, 1896 – April 10, 1905

PROFESSIONAL BACKGROUND

U.S. Attorney, Southern District of California, 1891 – 1893

Private Practice, with Nathaniel P. Conrey and Clarence A. Miller, 1890 - 1891

Private Practice, 1887 - 1890

Private Practice, Ohio, 1872 –","1880

04/10/1905-10/10/1913","Matthew Thompson Allen 
Associate J ustice, Div ision 1 
April 10, 1905 to January 7, 1907 
Presiding J ustice, Div ision 1 
January 7, 1907 to October 10, 1913 
 
 
 Born September 17, 1848, Greenville, Ohio 
 Died October 10, 1913 
 
EDUC ATION 
 
 Privately  Studied un der Hon. D. M. Bra dbury,  
  Winchester, Indiana 
 Otterbein University , West erville, Ohio  
 
 State Bar Ad mission: Septem ber 17, 186 9, Indiana 
 
 
JUDIC IAL EX PERIEN CE 
 
 Presiding Justice , California Court of Appeal, Second Appellate District, Division 1 
 January  7, 1907 - October 10, 1 913 
 
 Associate Ju stice , California Court of Appeal, Second Appellate District, Division 1 
 April 10, 1905 - Januar y 7, 1907 
 
 Judge , Los A ngeles Superior Court 
 December 17, 189 6 – Apri l 10, 1905 
 
PROFESSIONAL BACKGROUND 
 
 U.S. Attorney , Sout hern District of California, 18 91 – 18 93 
 
 Private Practice , with Nat haniel P. Conrey  and Clarence A. Miller, 1890 - 1891 
 
 Private Practice , 1887 - 1890 
 
 Private Practice , Ohio, 18 72 – 1886 
 
 Partner,  of future Senator, Frank P. Fli nt, mid-1890  
 
 Assistant Pr osecuting At torney , Nineteenth Indiana Circuit, India na"
https://www.courts.ca.gov/documents/AllportJ.pdf,John R. Allport,2nd District Court of Appeal,Division 3,Associate,https://www.courts.ca.gov/images/AllportJ.jpg,"John Reichard Allport 
 Associate Justice, Division 3 
 August 7, 1969 to January 16, 1981 
 
Born October 20, 1913 in Cleveland, Ohio 
Died September 3, 2000 in rural Washington 

EDUCATION 
LL.B., University of Southern California Law School, 1939 
A.B., University of California at Los Angeles, 1935 
State Bar Admission: May, 1939 

JUDICIAL EXPERIENCE 
Associate Justice, California Court of Appeal, Second Appellate District, Division 3 
July 18, 1969 – January 16, 1981, Appointed by Governor Ronald Reagan 
Judge, Los Angeles Superior Court 
April 9, 1968 – August 7, 1969, Appointed by Governor Ronald Reagan 

PROFESSIONAL BACKGROUND 
Private Practice, Los Angeles, 1939-1942, 1946-1968 
U.S. Navy, 1942-1946",08/07/1969-01/16/1981,"John Reichard Allport 
Associate Justice, Division 3 
August 7, 1969 to January 16, 1981 
 
 
 Born October 20, 1913 in Cleveland, Ohio 
 Died September 3, 20 00 in rural Washington 
 
EDUC ATION 
 
 LL.B., University  of Sout hern California Law School, 1939 
 A.B., University of Califor nia at Los Angeles, 1935 
 
 State Bar Ad mission: May, 1939 
 
 
JUDIC IAL EX PERIEN CE 
 
 Associate Ju stice , California Court of Appeal, Second Appellate District, Division 3 
 July 18,  1969 – Januar y 16, 198 1, App ointed b y Governor Ronald Reagan 
 
 Judge , Los A ngeles Superior Court 
 April 9, 1 968 – August 7, 1969 , Appoi nted by Gover nor Ronald R eagan 
 
PROFESSIONAL BACKGROUND 
 
 Private Practice , Los Angeles, 1939 - 1 942, 1946 - 1968 
 
 U.S. Navy , 1942 - 1946"
https://www.courts.ca.gov/documents/AmerianR.pdf,Richard Amerian,2nd District Court of Appeal,Division 4,Associate,https://www.courts.ca.gov/images/AmerianR.jpg,"Richard Amerian, Associate Justice, Division 4
May 14, 1982 to April 3, 1984 

Born December 11, 1937 in Los Angeles, California
Died November 4, 2001 while vacationing in Las Vegas 

EDUCATION 
LL.B., University of Southern California Law School, 1962
Law Review, Order of the Coif 
B.A. Political Science, University of Southern California, 1959 
State Bar Admission: January 10, 1963 

JUDICIAL EXPERIENCE 
Associate Justice, California Court of Appeal, Second Appellate District, Division 4 
May 14, 1982 - April 3, 1984, Appointed by Governor Edmund G. Brown, Jr. 

Judge, Los Angeles Superior Court 
August 8, 1978 – May 14, 1982, Appointed by Governor Edmund G. Brown, Jr. 

Judge, Los Angeles Municipal Court 
February 19, 1970 - August 8, 1978, Appointed by Ronald Reagan, February 4, 1970 

PROFESSIONAL BACKGROUND 
Private Practice, 1989 – 2001 

Partner, Ervin, Cohen & Jessup, 1988 - 1989 

Partner,","Amerian & Amerian, 1975 - 1988 

Associate, Jacobs, Jacobs & Brown, 1965 - 1975 

05/14/1982-04/03/1984","Richard Amerian 
Associate J ustice, Div ision 4 
May 14, 1982 to April 3, 1984 
 
 Born Decem ber 11, 19 37 in Los Angeles, California 
 Died November 4, 20 01 w hile vacationing in Las Vegas 
 
EDUC ATION 
 
 LL.B., University  of Sout hern California Law School, 1962 
  Law Review, Order of the Coif 
 B.A. Political Science, Uni versity  of Southern California, 1959 
 
 State Bar Ad mission: January  10, 1963 
 
 
JUDIC IAL EX PERIEN CE 
 
 Associate Ju stice , California Court of Appeal, Second Appellate District, Division 4 
 May 14, 1982 - April 3, 1984, Ap point ed by Govern or Edm und G. Brown, Jr. 
 
 Judge , Los A ngeles Superior Court 
 August 8, 1978 – Ma y 14, 1982, Appo inted by Governor Edm und G. Brown, Jr. 
 
 Judge , Los A ngeles Municipal Court 
 February  19, 1970  - Augus t 8, 1 978, Appointed by Ronald Reagan, Februar y 4, 1970 
  
 
PROFESSIONAL BACKGROUND 
 
 Private Practice , 1989 –  2001 
 
 Partner , Ervin, Cohen & Jessup, 1988 -  1989 
 
 Partner , Horvitz, Lev y & Am erian, Encino, CA, 19 86 - 1988 
  
 Associate , Cox, Castle & Nicholson, L os Angeles, CA, 1965 – 1970 
 
 Associate , Hall & Mirassou, Redondo B each, CA, 1963 - 1965"
