url,text,date
https://www.courts.ca.gov/2862.htm,"Associate Justice, August 9, 1994 – October 31, 2022
Justice Judith Haller was nominated to the Fourth District California Court of Appeal in 1994, found to be ""exceptionally well qualified"" for the position, and unanimously confirmed by the Commission on Judicial Appointments on August 9, 1994. Justice Haller previously served as a San Diego Superior Court Judge for five years.
Justice Haller was born and raised in Los Angeles and graduated summa cum laude and Phi Beta Kappa from UCLA. After graduation, she moved to San Diego, where she earned a Master of Arts degree, with honors, from San Diego State University. She also worked for the university as an administrator in the Dean of Student Activities Office. Following a lifelong dream, she attended law school and, in 1975, graduated with honors from California Western School of Law.
After admission to the Bar, Justice Haller worked as a deputy district attorney for the San Diego District Attorney's Office for three years prosecuting criminal cases and litigating dependency matters. Over the next 10 years she worked at Higgs Fletcher and Mack, where she represented clients involved in civil litigation disputes. She was a partner at the firm when she was appointed to the superior court.
During her tenure at the appellate court, Justice Haller has been actively involved in a leadership role in organizations and committees devoted to improving the judicial system; maintaining the highest standards of ethical conduct; and educating members of the legal community. Among her work in this area, she was appointed by the Chief Justice to the Executive Committee of the Commission on the Future of California's Court System, where she served as chair of the Civil Working subgroup, and in 2017 made several recommendations to increase and improve assistance for self-represented litigants and streamline and reduce the cost of litigation in all civil cases.
Justice Haller is currently a member of the Supreme Court Committee on Judicial Ethics Opinions; a former chair of the California Judges Association Ethics Committee; and has served as a Special Master to preside over disciplinary hearings brought by the Commission on Judicial Performance. She is also a Master and member of the Executive Committee of the American Inns of Court, Enright Chapter; a Master of the San Diego Appellate Inn of Court; and a longtime member of Lawyers Club of San Diego and the Board of Trustees of California Western School of Law. For the past 10 years, she has served as the chair of the Appellate Court Legacy Project and has been a frequent lecturer at continuing education programs.
Justice Haller has been honored to be recognized by the legal community as a recipient of the Bernard E. Witkin, Esq. Award (presented annually for civic leadership and excellence in the teaching, practice, enactment or adjudication of the law); the Joan Dempsey Klein Distinguished Jurist Award (presented by California Women Lawyers for excellence as a jurist and commitment to gender equity); and a 2012 Professionalism Award (presented by the American Inns of Court Foundation).
Justice Haller and her husband have two children and three grandchildren.",08/09/1994-10/31/2022
https://www.courts.ca.gov/2610.htm,"Associate Justice, January 21, 1960 - August 30, 1971 Martin J. Coughlin was born in San Bernardino on August 30, 1901. He received both his undergraduate (1923) and law (1925) degrees from the University of California at Berkeley. On August 31, 1925, he was admitted to the State Bar. He returned to San Bernardino where he was in private practice from 1925 to 1945. He was extremely active in both legal and lay communities, serving on countless boards, foundations and committees. He was president of the San Bernardino County Bar Association in 1937. Governor Earl Warren appointed him Judge of the San Bernardino County Superior Court on December 17, 1945. During his 14-year tenure on the Superior Court, he served as the Presiding Judge four times (1946, 1949, 1954 & 1958) and the Presiding Judge of the Appellate Department from 1952 to 1960. Governor Edmund G. Brown, Sr. appointed him as an Associate Justice to the Fourth District Court of Appeal on January 20, 1960. He took the oath of office the following day. He would be the last circuit-riding justice appointed to the Fourth District before the creation of the Fifth District in Fresno in 1961. Later, he would be one of the last three justices to hear cases for the entire Fourth District. He served on the Judicial Council and the Commission on Judicial Qualifications. He retired on August 30, 1971 - his 70th birthday. During the years that followed, he often sat on temporary assignment at the Court. He died in Alameda on March 22, 1983.",01/20/1960-08/30/1971
https://www.courts.ca.gov/2759.htm,"Associate Justice, October 1, 1938 - July 25, 1958 Presiding Justice, July 25, 1958 - February 1, 1965 Lloyd E. Griffin was born on a farm at San Luis Rey in San Diego County on February 2, 1895. His grandparents were the first American settlers in San Diego County in 1862, when they came to the San Luis Rey Valley from Texas in an ox-drawn covered wagon. After his father died and his family moved to San Diego when he was 17, the Board of Supervisors of which his father had been chairman gave him a job as a messenger boy at the courthouse at $40 a month. While studying law at night, he quickly moved from messenger boy to assistant law librarian, court commissioner and then to deputy clerk. He was admitted to the California Bar at 21 without the benefit of a formal college education. After serving as deputy District Attorney for several years, he was appointed to the Justice Court in 1923 and later elevated to the San Diego County Superior Court in 1927 - an office he held for 11 years. On October 1, 1938, Governor Frank Merriam appointed him Associate Justice for the Fourth District Court of Appeal and he took the oath of office the same day. He was elevated to Presiding Justice on July 25, 1958, a title he held until his retirement on February 1, 1965. His tenure at the Court is only second to that of his colleague, Presiding Justice Barnard. He served four years on the Judicial Council, as well as four years on the Commission on Judicial Qualifications -- a group he chaired at the time of his retirement. After retiring, he associated with the law firm of Higgs, Fletcher and Mack. Like many of his contemporaries, he was very active in several fraternal orders. He died on July 30, 1978, at the age of 83.",10/01/1938-02/01/1965
https://www.courts.ca.gov/2608.htm,"Associate Justice, March 2, 1972 - August 24, 1984 Gordon Cologne was born in Long Beach, California, on August 24, 1924. Educated in California, he graduated from Coachella Valley High School; received his bachelor of science degree from the University of Southern California in 1948; and obtained his law degree, cum laude, from Southwestern University in 1951. His undergraduate education was interrupted by World War II, during which he served in the United States Navy. Admitted to the State Bar in 1951, he served as a trial attorney for the U.S. Department of Justice, Antitrust Division, from 1951 to 1952, and then continued in private practice in Indio until 1972. He served as Mayor of the City of Indio from 1954 to 1956. Continuing his public service, he served in the State Assembly from 1962 to 1965 and the State Senate from 1965 until 1972. While in the Senate, he served as chairman of the Senate Water Resources Committee and the Senate Judiciary Committee. The Junior Chamber of Commerce recognized him as one of the five outstanding young men of California in 1960. He received the National Wildlife Federation Award for conservation in 1965 and the Freedoms Foundation Award in 1967. Governor Ronald Reagan appointed him to Division One of the Court of Appeal, Fourth Appellate District on February 24, 1972, and he took the oath of office on March 2, 1972. He taught evening classes in legislation as an adjunct professor at the University of San Diego School of Law. He retired from the bench on August 24, 1984. From 1986 to 1989, he served as special counsel to the California Medical Association. From 1987 to 1989, he was of counsel to Best, Best & Krieger, limiting his practice to government relations, water and toxics. He continues to enjoy his retirement.",03/02/1972-08/24/1984
https://www.courts.ca.gov/2605.htm,"Presiding Justice, May 13, 1930 - December 31, 1930
William Paxton Cary served as the second Presiding Justice of the Fourth District Court of Appeal. He was born in New York City on March 31, 1882. He attended Cornell University, graduating in 1904 with a bachelor of arts degree. He went to Butte, Montana where he engaged in mining work before obtaining his law degree in 1906. Upon being admitted to the Bar, he practiced law there until he moved to San Diego on January 1, 1914, where he continued his law practice. In 1917, he answered the Nation's call to arms; attended the Second Officers Training Camp at the Presidio of San Francisco; was commissioned as an infantry First Lieutenant; reported for duty at Camp Fremont; and was assigned to the Eighth Infantry. In 1918, he was promoted to Captain and served as company commander of Company H, Eighth Infantry, in France until the end of the war the following year. Upon his return, he continued to practice law until January 11, 1921, when Governor Stephens appointed him judge of the San Diego County Superior Court. Six years later, he left the bench to resume the trial lawyer role that he so much cherished. He was a founding partner of the law firm of Gray, Cary, Ames & Driscoll in 1927. Upon the death of Presiding Justice William A. Sloane in April 1930, Governor C.C. Young asked Judge Cary to serve as Presiding Justice of the Fourth District Court of Appeal. He declined. Later, he accepted the appointment on May 8, 1930, to serve through the remainder of that year and took the oath five days later. He then returned to trial work until 1939 when pneumonia forced him to discontinue it. Extremely active in the community, Presiding Justice Cary served as president of the San Diego County Bar Association and chairman of the San Diego Red Cross. He died of a heart attack at his Point Loma home on September 22, 1943.",05/13/1930-12/31/1930
https://www.courts.ca.gov/2601.htm,"Associate Justice, December 27, 1982 - February 16, 1988 Edward Thomas Butler was born in Grand Rapids, Michigan on February 27, 1918. He graduated from South High School of Grand Rapids in 1936. He was a schoolmate of President Gerald Ford, although the latter was several years his senior. He worked his way through college, doing odd jobs in a drugstore and furniture factory and serving in the Merchant Marine. In 1941, he obtained his bachelor of arts degree from George Washington University in Washington, D.C. He then joined the United States Marine Corps as a Lieutenant. During World War II, he served in the Pacific Theater with the 1st Marines, receiving the Bronze Star for service at Guadalcanal and honorably discharged five years later as a Major. In 1948, he received his law degree from Harvard University Law School. He was admitted to the California Bar on January 4, 1949. For the next decade, he was an associate and then partner in the Los Angeles law firm of Lawler, Felix & Hall. However, the Korean War interrupted his law practice, as he returned to the Marines for two years serving as legal officer for the 1st Marine Air Wing in Korea and at El Toro. He became a Lieutenant Colonel at the age of 31. In 1959, he moved to San Diego where he was general counsel and senior vice president of Electro Instruments, Inc. until 1963. In January 1964, he was appointed City Attorney of San Diego -- a position he was elected to in 1965 and held until his resignation in February 1969. From 1969 to 1975, he was a partner in the San Diego law firm of Schall, Butler, Boudreau & Gore. He was an unsuccessful candidate for Mayor of San Diego in 1971, losing in the general election to Pete Wilson who later became Governor. His significant public service to the City of San Diego is reflected by his service on its Economic Development Commission, Charter Review Commission and Economic Opportunity Commission. He also served on the Attorney General's Advisory Committee on Obscenity from 1965 to 1966 and the Governor's Commission on the Law of Preemption from 1966 to 1967. A former President of the Friendly Sons of Saint Patrick, he was chosen ""man of the year"" in 1976. After his appointment by Governor Edmund G. Brown, Jr., he served on the San Diego County Superior Court from September 23, 1975. The Governor elevated him to Division One of the Court of Appeal, Fourth Appellate District on December 3, 1982. The oath of office was administered on December 27, 1982. The San Diego Trial Lawyers Association named him ""Trial Judge of the Year"" in 1980. He retired from the Court of Appeal on February 16, 1988. For the next decade, he engaged in private dispute resolution. In 2000, the San Diego City Council proclaimed February 27 ""Ed Butler Day"" in San Diego. He died Christmas Eve, 2003.",12/27/1982 - 02/16/1988
https://www.courts.ca.gov/2590.htm,"Associate Justice, February 4, 1963 - March 16, 1965 Presiding Justice, March 16, 1965 - June 3, 1985 Born on June 4, 1915 in Chamberlain, South Dakota, Gerald Brown was the son of the first president of the South Dakota State Bar Association and grandson of a presiding justice of the South Dakota Supreme Court. In 1933, he graduated valedictorian of his high school class and came to California to attend the University of Southern California from which he would graduate as a member of Phi Beta Kappa Society in 1937. He received his law degree from Yale University Law School in 1941 and was admitted to the California Bar on December 8, 1942. He then practiced law in Los Angeles with O'Melveny & Myers (1942-1943) and the Santa Fe Railway Company (1944-1947) before moving to Riverside, where he was a member of the law firm of Best, Best & Krieger from 1949 to 1963. Following his father's footsteps, he attended Oxford University in England as a Rhodes Scholar before his move to Riverside and obtained his M.A. in 1949. The Browns were the first father-son Rhodes Scholars from the United States. Governor Edmund G. Brown, Sr. appointed him Associate Justice of the Fourth District Court of Appeal on January 30, 1963. The oath of office was administered on February 4th. Two years later on March 16, 1965, Governor Brown elevated him to Presiding Justice upon the retirement of Presiding Justice Lloyd Griffin. With the creation of Division Two in San Bernardino in 1965, he and Associate Justices Martin Coughlin and Vincent Whelan were the last justices to hear cases for the entire Fourth District. He became the Administrative Presiding Justice for the Court of Appeal, Fourth Appellate District in 1970 -- an office he held until his retirement on June 3, 1985. He twice served as a member of the Judicial Council, 1971 to 1975 and 1981 to 1985. As a jurist, he was renowned for his concise and plainly written opinions; as a Presiding Justice, he was renowned for overseeing an extremely efficient intermediate appellate court. His vast interests beyond the law carried him into retirement, including motorcycling, classical music, lawn bowling, photography and world traveling.",02/04/1963-06/03/1985
https://www.courts.ca.gov/2858.htm,"Associate Justice, June 3, 1987 to July 31, 2021
Governor George Deukmejian appointed Patricia Benke to the Fourth District Court of Appeal, Division One in May of 1987. She was confirmed by the Commission on Judicial Appointments and took her oath of office on June 3, 1987. The California State Bar Association Commission on Judicial Nominees Evaluation rated her at its highest level, ""exceptionally well qualified"" for appointment to the Court of Appeal. The Clerk of the Court confirms that at the time of her appointment Justice Benke had the distinction of being the youngest person ever appointed to any Court of Appeal in California. She was the first woman appointed to the Fourth District Court of Appeal, Division One. Justice Benke was twice a candidate for the California Supreme Court.
Judicial and Professional History
Justice Benke began her legal career as a Deputy Attorney General for the State of California (1974-1983). She drafted briefs and represented the State of California in cases before the United States Supreme Court, California Supreme Court and in the Fourth District Court of Appeal, Divisions One (San Diego), Two (San Bernardino) and Three (Orange County). Justice Benke served as a trial attorney on special assignment to the San Diego District Attorney's Office and Imperial County District Attorney's Office. She also served as a member of the Attorney General’s Legislative Task Force, reviewing all proposed legislation affecting appellate procedure, probation and parole. She was the Attorney General’s Representative to the State Conference on the Judiciary, Blue Ribbon Task Force on Probation and Parole and served as the Attorney General’s representative to district attorney regional conferences. Justice Benke co-compiled the Peace Officers’ Penal Code, a reference book used statewide by law enforcement officers in the field. She is a former state president of the California Association of Deputy Attorneys General.
In July of 1983 Governor George Deukmejian appointed Justice Benke to the San Diego Municipal Court where she presided over special departments, felony preliminary hearings, and criminal and civil trials. In June of 1985 Governor Deukmejian appointed her to the San Diego Superior Court. As a superior court judge, she heard criminal and civil trials and presided in the departments of family law and motion, and civil law and motion. Voters elected her to the Superior Court position in 1986. For both municipal and superior court appointments Justice Benke was rated ""exceptionally well qualified"" by the California Bar Association's Commission on Judicial Nominees.
In May of 1987 Governor Deukmejian appointed Justice Benke to her current position as an Associate Justice. On November 6, 1990, voters confirmed Justice Benke as an associate justice. She was reconfirmed by voters on November 8, 1994, and in November of 2006.
Professional Activities
Justice Benke's judicial activities include appointment to the California Judicial Council, a statewide body charged with improving the administration of justice in California. She served on judicial advisory committees including those examining the future of appellate courts and the adequacy of payment to attorneys representing the indigent. She is a member of the Appellate Indigent Defense Oversight Committee which audits the state's appellate indigent defense budget and advises on policy. Justice Benke served on the Advisory Committee on Rules for Publication of Court of Appeal Opinions.
Justice Benke is an advocate of adult and second career education. She currently serves as a core adjunct professor in National University’s Department of Criminal Justice Administration. She has also taught in the university's Leadership and Business Ethics tracks.
Recognition
Selected as one of five members of the San Diego County Bar Association's ""Legends of the Bar, 2018"" project.
Among her recognitions, Justice Benke in 2007 received the Distinguished Alumni Award from the University of San Diego School of Law. She was the first recipient of the Napoleon A. Jones, Jr. Award for Judicial Excellence for ""Distinguished Service to Justice and Commitment to Diversity and Community Service"" presented by the Earl Gilliam Bar Association.
Community Involvement
Justice Benke is a sponsor and volunteer at one of San Diego’s therapeutic riding programs.
She is an award-winning novelist.
Before her appointments to the bench Justice Benke was a member of San Diego’s Park and Recreation Board, which advises the San Diego City Council and mayor on development and maintenance of the parks and recreation facilities in the city. She served as the Board's Chairperson for Balboa Park.
Education and Admission to Practice
Justice Benke received her law degree from The University of San Diego School of Law where she served as the managing editor of the San Diego Law Review.
She was admitted to practice before the California Bar, the Federal District Court for the Southern District of California, the Ninth Circuit Court of Appeals, and the Supreme Court of the United States.
Justice Benke is married and has two children.",06/03/1987-07/31/2021
https://www.courts.ca.gov/2595.htm,"Associate Justice, September 14, 1929 - December 31, 1930 Presiding Justice, January 1, 1931 - June 30, 1958 Charles R. Barnard served as the third Presiding Justice of the Fourth District Court of Appeal and remains as its longest serving Justice. He was born in Warrenville, Illinois, on December 28, 1881. After attending high school in Centralia, Illinois, he went to Grinnell College in Iowa, from which he graduated in 1904. Three years later, he obtained his law degree from the University of Iowa. On September 15, 1907, he established his residence in Fresno, where he practiced law until 1925. He served as chairman of the Fresno City Board of Education. Governor Friend W. Richardson appointed him to the Fresno County Superior Court on June 3, 1925, an office to which he was elected in 1926 and reelected in 1928. On September 6, 1929, Governor C.C. Young appointed him as one of the three Justices to first serve on the newly established Fourth District Court of Appeal. He took the oath of office on September 14, 1929. He was elected Presiding Justice in 1930, an office he assumed on January 1, 1931. Reelected several times, Presiding Justice Barnard would hold that title for more than 27 years until his retirement on June 30, 1958. In fact, Presiding Justice Barnard sat on the Fourth District Court of Appeal longer than any other Justice, just shy of 29 years. He was named to the Judicial Council in 1932 and served as a Justice pro tem on the California Supreme Court in 1938. Like many of his contemporaries, he was very active in a number of fraternal orders. He died on March 16, 1968",", in Fresno.

09/14/1929-06/30/1958"
https://www.courts.ca.gov/2591.htm,"Richard B. Ault was born in Bryant, South Dakota on February 19, 1917. Eight years later, he moved with his family to San Diego where he attended public schools. In 1938, he graduated from San Diego State College, where his father Jesse W. Ault was a professor and Dean of Education. During his senior year, he served as president of the Associated Students Body. He did graduate work at the University of California at Berkeley from 1939 to 1940, receiving a master's degree in history and a secondary teaching credential. Following his father's footsteps, he taught six years at Point Loma High School and Dana and Roosevelt Junior High Schools, while attending Balboa Law School (now California Western University Law School) at nights. In 1946, he graduated from law school, was admitted to the State Bar and joined his father-in-law's firm where he would specialize in general trial work and worker's compensation cases. Governor Goodwin Knight appointed him nine years later to the Municipal Court and then elevated him two years later to the San Diego County Superior Court in 1957. At the time of his elevation, he was 40 and the youngest judge ever appointed to the San Diego County Superior Court. He served two years as its Presiding Judge in 1967 and 1968. On December 19, 1969, Governor Ronald Reagan appointed him as an Associate Justice to Division One of the Court of Appeal, Fourth Appellate District. He took the oath of office on January 13, 1970. He retired from the Court on March 31, 1977, returning to the practice of law with his sons in the San Diego firm of Ault, Midlam and Deuprey. He served as alumni president of San Diego State University for several years and also on the Board of Directors at California Western School of Law. He enjoyed writing poetry, penning verse about his court cases, political issues or any matters that he found amusing or interesting. He died on January 10, 2000.",02/19/1917-03/31/1977
https://www.courts.ca.gov/75602.htm,"Judge Helen E. Williams was appointed to the Santa Clara Superior Court by Governor Brown in 2012 after having been in private civil practice for many years. Before her appointment, Judge Williams was certified by the State Bar as an appellate specialist and served for eight years as an appellate research attorney at the Sixth District Court of Appeal. Judge Williams received her undergraduate degree from UCSC and her JD from Santa Clara Law School. Judge Williams has served as a judge for over 10 years in civil and criminal assignments, and has also served for many years as the Presiding Judge of the Santa Clara Superior Court’s appellate division. She has served on numerous state and local committees with appellate focus, including as Chair of the State Bar’s Committee on Appellate Courts and Chair of the Appellate Law Advisory Committee to the State Bar's Board of Legal Specialization, and currently serves as an appointed member of the Judicial Council’s Appellate Advisory Committee.",12/12/2012-N/A
